"Factors Motivating the Adoption of Self-Healthcare Monitoring Mobile Applications by the South African Youth","P. Ndayizigamiye; T. C. Soni; N. Jere","University of KwaZulu-Natal, Private Bag X01, Pietermaritbzurg, South Africa; University of KwaZulu-Natal, Private Bag X01, Pietermaritbzurg, South Africa; University of KwaZulu-Natal, Private Bag X01, Pietermaritbzurg, South Africa","2018 IST-Africa Week Conference (IST-Africa)","23 Jul 2018","2018","","","Page 1 of 7","Page 7 of 7","The global burden of non-communicable diseases requires multi-facetted, preventive and curative interventions. The diseases are no longer attributed to “old age” but are increasingly becoming prevalent amongst young people. Hence, there is a need for preventive and curative interventions that are particularly appealing to young people. The wide adoption of mobile technologies amongst the youth, especially in developing countries, makes mobile health interventions appealing to the youth. Thus, self-healthcare monitoring applications could be widely adopted by the youth, if designed in a way that is appealing to them. It is in this context that this paper investigates factors that could influence the use of self-healthcare monitoring mobile applications by the South African youth. From a sample of 280 students conveniently sampled from an institution of higher learning in South Africa, findings reveal that factors that motivate the use of mobile self-healthcare applications include results demonstrability, performance expectancy factors, savings, social aspects, awareness, connectivity, accessibility, ease of use, privacy, user satisfaction and affordability. Hence, this paper advocates for a multi-stakeholder approach to ensure that these factors are taken into consideration during the design and implementation of such mHealth applications.","2576-8581","978-1-905824-60-1","","","https://ieeexplore.ieee.org/stamp/stamp.jsp?arnumber=8417189","mHealth;nCDs;self-healthcare monitoring;South Africa;NCDs","Monitoring;Diseases;Privacy;Mobile applications;Stakeholders;Smart phones","","","","33","","23 Jul 2018","","","IEEE","IEEE Conferences"
"Building an Evidence Base Using Qualitative Data for mHealth Development","B. Bock; N. Barnett; R. Rosen; K. Walaska; H. Thind; V. Cobb","Centers for Behavioral and Preventive Medicine, The Miriam Hospital, Providence, RI; Centers for Behavioral and Preventive Medicine, The Miriam Hospital, Providence, RI; Centers for Behavioral and Preventive Medicine, The Miriam Hospital, Providence, RI; Dept. of Behavioral and Social Sciences, Brown School of Public Health, Providence, RI; Centers for Behavioral and Preventive Medicine, The Miriam Hospital, Providence, RI; Centers for Behavioral and Preventive Medicine, The Miriam Hospital, Providence, RI","2014 47th Hawaii International Conference on System Sciences","10 Mar 2014","2014","","","2655","2664","To be successful mHealth applications must be consistent with the way individuals use technology. Using qualitative methods and an iterative approach that blends consumer-driven and investigator-driven aims can produce paradigm-shifting, novel intervention applications that maximize the likelihood of use by the target audience and their potential impact on health behaviors. In behavioral health the development of mHealth applications often takes a top-down approach driven by the investigators and programmers, with relatively little input from the targeted population. Often user-input is limited to ""like/dislike"" post-intervention consumer satisfaction ratings or device/application-specific user analytics. To have a lasting effect on health behaviors it is crucial to obtain user input from the start of each project and throughout development. This paper describes the use of qualitative methods in an end-user participatory framework, and demonstrates how this lead to important changes in our approach to health interventions delivered through mobile technologies.","1530-1605","978-1-4799-2504-9","10.1109/HICSS.2014.335","","https://ieeexplore.ieee.org/stamp/stamp.jsp?arnumber=6758935","mHealth;Qualitative Data;Smoking;Alcohol","Employee welfare;Recruitment;Text processing;Mobile handsets;Educational institutions;Hospitals;Mobile communication","","","","38","IEEE","10 Mar 2014","","","IEEE","IEEE Conferences"
"Exploring Contextual Engagement for Trauma Recovery","S. Dhamija; T. E. Boult",University of Colorado; University of Colorado,"2017 IEEE Conference on Computer Vision and Pattern Recognition Workshops (CVPRW)","24 Aug 2017","2017","","","2267","2277","A wide range of research has used face data to estimate a person's engagement, in applications from advertising to student learning. An interesting and important question not addressed in prior work is if face-based models of engagement are generalizable and context-free, or do engagement models depend on context and task. This research shows that context-sensitive face-based engagement models are more accurate, at least in the space of web-based tools for trauma recovery. Estimating engagement is important as various psychological studies indicate that engagement is a key component to measure the effectiveness of treatment and can be predictive of behavioral outcomes in many applications. In this paper, we analyze user engagement in a trauma-recovery regime during two separate modules/tasks: relaxation and triggers. The dataset comprises of 8M+ frames from multiple videos collected from 110 subjects, with engagement data coming from 800+ subject self-reports. We build an engagement prediction model as sequence learning from facial Action Units (AUs) using Long Short Term Memory (LSTMs). Our experiments demonstrate that engagement prediction is contextual and depends significantly on the allocated task. Models trained to predict engagement on one task are only weak predictors for another and are much less accurate than context-specific models. Further, we show the interplay of subject mood and engagement using a very short version of Profile of Mood States (POMS) to extend our LSTM model.","2160-7516","978-1-5386-0733-6","10.1109/CVPRW.2017.281","","https://ieeexplore.ieee.org/stamp/stamp.jsp?arnumber=8015015","","Context modeling;Predictive models;Face;Videos;Machine learning;Mood;Facial features","","8","","68","IEEE","24 Aug 2017","","","IEEE","IEEE Conferences"
"Assessing the Impact of Engagement and Real-Time Feedback in a Mobile Behavior Change Intervention for Supporting Critical Thinking in Engineering Research Projects","Y. A. Asiri; D. E. Millard; M. J. Weal","School of Electronics and Computer Science, University of Southampton, Hampshire, U.K.; School of Electronics and Computer Science, University of Southampton, Hampshire, U.K.; School of Electronics and Computer Science, University of Southampton, Hampshire, U.K.","IEEE Transactions on Learning Technologies","20 Oct 2021","2021","14","4","445","459","Digital behavior change interventions (DBCIs) provide customized advice, ongoing support, and Web- and mobile-based platforms for learners who want to change their undesirable behaviors. DBCIs have been successful in the past for delivering interventions that support sustained changes to health behaviors, such as disease prevention and health promotion. During research tasks, university students can require interventions associated with critical thinking skills and behaviors. By using a DBCI, educators can assist students with improving their learning skills in research projects. This study aims to understand student interactions and engagement with mobile-based DBCIs with the objective of improving their critical thinking skills. An experimental group was used to explore the effects of students’ interactions with an engaging mobile-based DBCI with real-time feedback and it was designed using the LifeGuide Toolbox platform, which supports their critical thinking skills over a period of two months while they conduct a research project. A comparison between formative expert assessments and self-reported evaluation was also performed. This experiment reveals that using a DBCI to encourage critical thinking skills within a research project context can significantly improve engagement with intervention components, as well as recommend areas that require further exploration where specific critical thinking skills and digital interventions components are the most promising.","1939-1382","","10.1109/TLT.2021.3104817","","https://ieeexplore.ieee.org/stamp/stamp.jsp?arnumber=9513591","Critical thinking;digital intervention;human–computer interaction design;mobile learning;research projects.","Tools;Real-time systems;Task analysis;Education;Computer science;Cognition;Standards","","5","","65","IEEE","13 Aug 2021","","","IEEE","IEEE Journals"
"Promoting a healthy lifestyle: Towards an improved personalized feedback approach","R. Achterkamp; M. Cabrita; H. op den Akker; H. J. Hermens; M. M. R. Vollenbroek-Hutten","Faculty of Electrical Engineering, University of Twente, Enschede, The Netherlands; Roessingh Research and Development, Universidade Nova de Lisboa, Lisbon, Portugal; Roessingh Research and Development, University of Twente; Roessingh Research and Development, University of Twente; Roessingh Research and Development, University of Twente","2013 IEEE 15th International Conference on e-Health Networking, Applications and Services (Healthcom 2013)","27 Jan 2014","2013","","","725","727","Technology supported services for achieving a healthy lifestyle have shown their short term effects and are receiving increasing interest from the research community. However, long term adherence to these services is poor. This paper describes research-in-progress regarding the implementation of automated goal-setting and tailored feedback messages into one such technology supported service, which aims to improve the user's physical activity pattern. Tailored feedback messages for several personas were set up based on theories from behavioral science and categorized by experts during an expert workshop. Results indicate reasonable agreement on the matching of motivational messages to four personas. Additional expert input is discussed descriptively. Future research will focus on examining the effectiveness of the new version of the service under investigation.","","978-1-4673-5801-9","10.1109/HealthCom.2013.6720772","","https://ieeexplore.ieee.org/stamp/stamp.jsp?arnumber=6720772","Accelerometers;Behavioral science;Physical activity;Telemedicine","","","5","","13","IEEE","27 Jan 2014","","","IEEE","IEEE Conferences"
"Sensible or too Sensitive? Do Privacy Concerns Hinder the Acceptance of Digital Solutions to Treat Smartphone Addiction?","S. Kloker; M. L. Riegel; C. Weinhardt","IISM, Karlsruhe Institute of Technology (KIT), Germany; IISM, Karlsruhe Institute of Technology (KIT), Germany; IISM, Karlsruhe Institute of Technology (KIT), Germany","2020 IEEE 22nd Conference on Business Informatics (CBI)","15 Jul 2020","2020","2","","10","19","While the adoption of new information systems is predominantly seen as a positive phenomenon, there is increasing evidence of negative consequences for users - reflected in paper titles featuring terms like Internet Addiction, Technostress, or Social Networking Sites Addiction. Particularly the smartphone - potentially due to its high prevalence and its character as ”medium” for all kinds of information - was found to be associated with problematic usage behavior. Traditional intervention approaches like “Digital Detox” or Cognitive Behavior Therapy are not practical or scalable enough. However, there are examples of digital solutions to tackle problematic smartphone use - but their impact has not been examined thoroughly yet. We developed a new approach by conceptualizing four versions of digital Usage Management Tools (UMTs), which give the user personalized recommendations based on different types of private data. To test whether smartphone users would accept these UMTs, we conducted an online survey with 192 participants. The general evaluation of our UMTs was positive but deteriorated significantly after the privacy disclosure. We found that a higher degree of Privacy Concerns reduces the likelihood that an individual accepts our UMTs, while a higher degree of Smartphone Addiction increases it.","2378-1971","978-1-7281-9926-9","10.1109/CBI49978.2020.10053","","https://ieeexplore.ieee.org/stamp/stamp.jsp?arnumber=9140272","Smartphone Addiction;Privacy Concerns;Online Experiment;Non-addictive Information Systems","Privacy;Data privacy;Information systems;Internet;Tools;Social network services;Medical treatment","","2","","82","IEEE","15 Jul 2020","","","IEEE","IEEE Conferences"
"LETHE: A Digital Intervention for Cognitive Decline*","V. S. Loukas; T. Kassiotis; I. L. Martinez; L. Koumakis; J. Bruinsma; R. Pasciuti; M. Balatresi; V. Tenhunen; A. Fiakkas; L. Ataliani; G. S. Karanasiou; M. Tsiknakis; H. Hilberger; M. Bödenler; B. Schnalzer; S. Huber; M. Pirani; M. Colombo; S. Hanke; D. I. Fotiadis","Dept. of Materials Science and Engineering, Unit of Medical Technology and Intelligent Information Systems, University of Ioannina, Ioannina, Greece; Computational BioMedicine Laboratory, Institute of Computer Science, FORTH-ICS, Heraklion, Greece; EGI Foundation, Amsterdam, The Netherlands; Computational BioMedicine Laboratory, Institute of Computer Science, FORTH-ICS, Heraklion, Greece; Dept. of Health Promotion, Care and Public Health Research Institute, Maastricht University, Maastricht, The Netherlands; ExtraRed Innovations, Pisa, Italy; ExtraRed Innovations, Pisa, Italy; EGI Foundation, Amsterdam, The Netherlands; Infotrend Innovations Co. Ltd, Nicosia, Cyprus; Infotrend Innovations Co. Ltd, Nicosia, Cyprus; Dept. of Materials Science and Engineering, Unit of Medical Technology and Intelligent Information Systems, University of Ioannina, Ioannina, Greece; Computational BioMedicine Laboratory, Institute of Computer Science, FORTH-ICS, Heraklion, Greece; eHealth Institute, FH Joanneum, University of Applied Sciences, Graz, Austria; eHealth Institute, FH Joanneum, University of Applied Sciences, Graz, Austria; eHealth Institute, FH Joanneum, University of Applied Sciences, Graz, Austria; eHealth Institute, FH Joanneum, University of Applied Sciences, Graz, Austria; Innovation2Grow, I2G, Bologna, Italy; Innovation2Grow, I2G, Bologna, Italy; eHealth Institute, FH Joanneum, University of Applied Sciences, Graz, Austria; Dept. of Materials Science and Engineering, Unit of Medical Technology and Intelligent Information Systems, University of Ioannina, Ioannina, Greece","2023 45th Annual International Conference of the IEEE Engineering in Medicine & Biology Society (EMBC)","11 Dec 2023","2023","","","1","4","Dementia is the main cause of disability in elderly populations. It has been shown that the risk factors of dementia are a mixture of pathological, lifestyle and heritable factors, with some of those being provably modifiable. Early diagnosis of dementia and approaches to slow down its evolution are currently the most prominent management methodologies due to lack of a cure. For that reason, a plethora of home-based assistive technologies for dementia management do exist, with most of them focusing on the improvement of memory and thinking. The main objective of LETHE is prevention in the whole spectrum of cognitive decline in the elderly population at risk reaching from asymptomatic to subjective or mild cognitive impairment to prodromal Dementia. LETHE will provide a Big Data collection platform and analysis system, that will allow prevention, personalized risk detection and intervention on cognitive decline. Through the subsequent 2-year clinical trial, the LETHE system, as well as the respective knowledge gained will be evaluated and validated. The scope of the current paper is to introduce the LETHE study and its respective novel platform as a holistic approach to multidomain lifestyle intervention trial studies. The present work depicts the architectural perspective and extends beyond state-of-the-art guidelines and approaches to health management systems and cloud platform development.Clinical Relevance — Patient Management Systems as well as lifestyle management platforms have significant clinical relevance as they allow for remote and continuous monitoring of patients' health status. LETHE aims to improve patient outcomes by providing predictive models for cognitive decline and patient adherence to the multimodal lifestyle intervention, enabling prompt and appropriate medical decisions.","2694-0604","979-8-3503-2447-1","10.1109/EMBC40787.2023.10340897","","https://ieeexplore.ieee.org/stamp/stamp.jsp?arnumber=10340897","","Pathology;Protocols;Sociology;Memory management;Biomarkers;Predictive models;Statistics","Humans;Aged;Cognitive Dysfunction;Risk Factors;Health Behavior;Life Style;Dementia","","","16","IEEE","11 Dec 2023","","","IEEE","IEEE Conferences"
"The potential of m-health systems for diabetes management in post conflict regions a case study from Iraq","R. S. H. Istepanian; A. Mousa; N. Haddad; A. Sungoor; T. Hammadan; H. Soran; T. Al-Anzi","Department of Electrical and Electronic Engineering, Imperial College, London, UK; Basra Medical College, Basra, Iraa; Basra Medical College, Basra, Iraa; Basra Medical College, Basra, Iraq; Basra Medical College, Basra, Iraa; Cardiovascular Trials Unit and Department of Medicine, Central Manchester University Hospitals, Manchester, UK; University of Dammam, Kingdom of Saudi Arabia","2014 36th Annual International Conference of the IEEE Engineering in Medicine and Biology Society","6 Nov 2014","2014","","","3650","3653","The recent developments of m-health technologies particularly in the developing world are increasing sharply due to the importance and accelerated adoption of these technologies in the developing countries. However, there are few if any studies on the effectiveness of mobile health in post conflict regions especially in the Middle East region. In this paper we describe the design, implementation and clinical outcomes of a feasibility study on mobile diabetes management in Basra, Southern Iraq as an exemplar for the effectiveness of mobile health technologies for improved healthcare delivery in similar post conflict regions. The key clinical outcome of this study indicated the lowering of HbA1C levels in the mobile health group indicating the potential of deploying such technologies in these regions where health resources are limited and challenging.","1558-4615","978-1-4244-7929-0","10.1109/EMBC.2014.6944414","","https://ieeexplore.ieee.org/stamp/stamp.jsp?arnumber=6944414","","Diabetes;Mobile communication;Mobile handsets;Sugar;Education;Medical diagnostic imaging","Adult;Aged;Blood Glucose;Blood Glucose Self-Monitoring;Case-Control Studies;Delivery of Health Care;Diabetes Mellitus, Type 2;Feasibility Studies;Follow-Up Studies;Glycated Hemoglobin A;Humans;Iraq;Middle Aged;Software;Telemedicine","7","","9","IEEE","6 Nov 2014","","","IEEE","IEEE Conferences"
"Improve student placement using job competency modeling and personalized feedback","M. D. Soumya; T. Sugathan; K. Bijlani","Kamal Bijlani Amrita e-Learning Research Lab (AERL), Amrita School of Engineering, Amrita Vishwa Vidyapeetham, Amrita University, Amritapuri, India; Kamal Bijlani Amrita e-Learning Research Lab (AERL), Amrita School of Engineering, Amrita Vishwa Vidyapeetham, Amrita University, Amritapuri, India; Kamal Bijlani Amrita e-Learning Research Lab (AERL), Amrita School of Engineering, Amrita Vishwa Vidyapeetham, Amrita University, Amritapuri, India","2017 International Conference on Advances in Computing, Communications and Informatics (ICACCI)","4 Dec 2017","2017","","","1751","1755","Identifying students' eligibility for a specific job is crucial even before commencement of the Job? Placement process. In this study, a tailored method has been proposed to generate a personalized job competency profile. First, the domain competencies are identified for a specific job. Secondly, the job competency score is calculated based on students' past performances, pertinent to the relevant domain competencies. Students with low scores can review their results with the personalized feedback. This should help student improve his/her skill in the required area to attempt the domain tests. With this improved scores, the students become eligible to participate in the placement process for a specific job. The domain tests will provide the score for each concept and the student can identify the gaps in their knowledge.","","978-1-5090-6367-3","10.1109/ICACCI.2017.8126097","","https://ieeexplore.ieee.org/stamp/stamp.jsp?arnumber=8126097","Assessment;Competency;Knowledge Representation;Concepts;Placement","Programming;Interviews;Software;Recruitment;History;Engineering profession;Organizations","","4","","17","IEEE","4 Dec 2017","","","IEEE","IEEE Conferences"
"Prediction of Psychological Flexibility with multi-scale Heart Rate Variability and Breathing Features in an “in-the-wild” Setting","A. Tiwari; J. L. Villatte; S. Narayanan; T. H. Falk","Institut national de la recherche scientifique, INRS-EMT, Montreal, Canada; University of Washington, Seattle, USA; University of Southern California, Los Angeles, USA; Institut national de la recherche scientifique, INRS-EMT, Montreal, Canada","2019 8th International Conference on Affective Computing and Intelligent Interaction Workshops and Demos (ACIIW)","8 Dec 2019","2019","","","297","303","Psychological flexibility (PF) has recently emerged as an important determinant in pain related outcomes. It is related to pain adaptation, social functioning and emotional well-being. A recent study indicates PF being a significant predictor of heart rate variability (HRV) and mediating relationship between HRV and pain interference. In recent years, HRV has been studied using non-linear dynamics approaches which better quantify the fractal behavior of the inter-beat interval time series. In this study, we propose the use of multi-scale HRV features for predicting PF. The new features are tested on a dataset collected from 200 hospital workers (nurses and staff) during their normal work shifts. We show that fusion of breathing signal features further improves the performance showing the complementarity of two feature sets. We achieve an overall improvement of 4.54% F1-score over benchmark HRV features. These results indicate the importance of non-linear features for PF measurement. An accurate measurement of PF can help in developing pain and distress intervention methods by unobtrusive measurement of physiological signals using wearable sensors in real life conditions.","","978-1-7281-3891-6","10.1109/ACIIW.2019.8925281","","https://ieeexplore.ieee.org/stamp/stamp.jsp?arnumber=8925281","pain;psychological flexibility;heart rate variability;SVM;wearable sensors","Heart rate variability;Feature extraction;Pain;Time series analysis;Psychology;Benchmark testing","","3","","39","Crown","8 Dec 2019","","","IEEE","IEEE Conferences"
"Backend Concept of the eSano eHealth Platform for Internet- and Mobile-based Interventions","A. R. Idrees; R. Kraft; R. Pryss; M. Reichert; T. Nguyen; L. Stenzel; H. Baumeister","Department of Clinical Psychology and Psychotherapy, Ulm University, Germany; Department of Clinical Psychology and Psychotherapy, Ulm University, Germany; Institute of Clinical Epidemiology and Biometry, University of Würzburg, Germany; Institute of Databases and Information Systems, Ulm University, Germany; Department of Clinical Psychology and Psychotherapy, Ulm University, Germany; Department of Clinical Psychology and Psychotherapy, Ulm University, Germany; Department of Clinical Psychology and Psychotherapy, Ulm University, Germany","2022 18th International Conference on Wireless and Mobile Computing, Networking and Communications (WiMob)","15 Nov 2022","2022","","","88","93","Mental disorders represent an ongoing challenge to global health and can affect anyone at any age from any region in the world. The response of healthcare providers to mental health disorders still lags behind that of other diseases and a significant number of people who are affected by mental health disorders do not receive adequate treatment. The widespread usage of Internet-connected devices provides new opportunities to deliver treatment to more people using innovative approaches. The groundwork is being laid for the adoption of Internet- and mobile-based interventions, providing mental and behavioral health support to more people and narrowing the treatment gap. This paper discusses the main technical details of the backend API of the eSano eHealth platform as an example for a complex and comprehensive IT-framework for large-scale and flexible Internet- and mobile-based interventions. An overview of eSano is provided and the platform is compared with other technical solutions in the field. In addition, the components of eSano are described and further technical insights are elaborated in more detail. To this end, the work at hand demonstrates the main requirements of the backend API powering eSano, its concepts and the overall developed solution. It will as such inform researchers and practitioners about state-of-the-art backend API development in the eHealth context.","2160-4894","978-1-6654-6975-3","10.1109/WiMob55322.2022.9941520","","https://ieeexplore.ieee.org/stamp/stamp.jsp?arnumber=9941520","eHealth-Platforms;eSano;Internet-Interventions;Mental-Disorders;Behavior-Change","Wireless communication;Mental disorders;Mental health;Electronic healthcare;Behavioral sciences;Mobile computing;Diseases","","3","","23","IEEE","15 Nov 2022","","","IEEE","IEEE Conferences"
