"Designing a Health Coach-Augmented mHealth System for the Secondary Prevention of Coronary Heart Disease Among Women","A. Sengupta; K. Dutta; T. Beckie; S. Chellappan","Information Systems and Decision Sciences, University of South Florida, Tampa, FL, USA; Information Systems and Decision Sciences, University of South Florida, Tampa, FL, USA; College of Nursing, University of South Florida, Tampa, FL, USA; Department of Computer Science and Engineering, University of South Florida, Tampa, FL, USA","IEEE Transactions on Engineering Management","3 Nov 2022","2022","69","6","3085","3100","While the number of women with Coronary Heart Disease requiring cardiac rehabilitation (CR) continues to increase, lack of access and other barriers to center-based CR present significant challenges. A mobile phone and wearable device-based technological system can offer home-based secondary prevention program for CHD. We have designed a women-specific digital health intervention system for use in a home-based CR program. The system that we have proposed combines human-expert intelligence with machine intelligence to enhance the decision-making capability of a health coach. We have evaluated the prototype of our system with eight women with CHD for over 13 weeks. The evaluation has shown a significant positive impact of preprogrammed intervention messages on participants’ walking performance on the same and the next day. Since increased walking activities directly improve heart health, we can directly infer that our proposed system is beneficial as a tool for secondary prevention among women with CHD.","1558-0040","","10.1109/TEM.2020.2997662","NSF I-Corps; USF Bull Ring Accelerator Grant; USF Women in Leadership and Philanthropy Heart Health Faculty Research Award; USF Strategic Investment Pool Award; ","https://ieeexplore.ieee.org/stamp/stamp.jsp?arnumber=9244615","Coronary heart disease;digital intervention;home based cardiac rehabilitation;mobile health technology;system design;theory based behavior intervention","Heart;Prototypes;Patient monitoring;Cardiac disease;Patient rehabilitation;System analysis and design","","5","","86","IEEE","29 Oct 2020","","","IEEE","IEEE Journals"
"A Patient Centered Cloud Platform for Mobile-Health Enabled Clinical Research","B. Witbrodt; V. Sunderam","Emory University, Atlanta, USA; Emory University, Atlanta, USA","2016 IEEE First International Conference on Connected Health: Applications, Systems and Engineering Technologies (CHASE)","18 Aug 2016","2016","","","54","60","Mobile collection and curation of health data is becoming increasingly common, offering great potential for health insights and digital interventions. There is increasing interest among clinical researchers to utilize these data streams for health science research, but the need for high levels of technical expertise and high costs of creating systems for aggregating and analyzing this data precludes such studies. Here we describe a patient-centered platform that enables rapid research-study design, real-time data collection and monitoring, and cloud storage of mobile data streams using simple user interfaces, built on an inexpensive and scalable cloud hosted system architecture.","","978-1-5090-0943-5","10.1109/CHASE.2016.50","","https://ieeexplore.ieee.org/stamp/stamp.jsp?arnumber=7545813","Mobile Health;Cloud Service Platform;Clinical Research;Patient Centered","Mobile communication;Data collection;Cloud computing;Real-time systems;Data models;Systems architecture;Databases","","1","","20","IEEE","18 Aug 2016","","","IEEE","IEEE Conferences"
"Real-Time Tele-Monitoring of Patients with Chronic Heart-Failure Using a Smartphone: Lessons Learned","D. Aranki; G. Kurillo; P. Yan; D. M. Liebovitz; R. Bajcsy","Department of Electrical Engineering and Computer Science, University of California, Berkeley, CA; Department of Electrical Engineering and Computer Science, University of California, Berkeley, CA; Department of Electrical Engineering and Computer Science, University of California, Berkeley, CA; University of Chicago Medicine, Chicago, IL; Department of Electrical Engineering and Computer Science, University of California, Berkeley, CA","IEEE Transactions on Affective Computing","20 May 2017","2016","7","3","206","219","We present a smartphone-based system for real-time tele-monitoring of physical activity in patients with chronic heart-failure (CHF). We recently completed a pilot study with 15 subjects to evaluate the feasibility of the proposed monitoring in the real world and examine its requirements, privacy implications, usability, and other challenges encountered by the participants and healthcare providers. Our tele-monitoring system was designed to assess patient activity via minute-by-minute energy expenditure (EE) estimated from accelerometry. In addition, we tracked relative user location via global positioning system (GPS) to track outdoors activity and measure walking distance. The system also administered daily surveys to inquire about vital signs and general cardiovascular symptoms. The collected data were securely transmitted to a central server where they were analyzed in real time and were accessible to the study medical staff to monitor patient health status and provide medical intervention if needed. Although the system was designed for tele-monitoring individuals with CHF, the challenges, privacy considerations, and lessons learned from this pilot study apply to other chronic health conditions, such as diabetes and hypertension, that would benefit from continuous monitoring through mobile-health (mHealth) technologies.","1949-3045","","10.1109/TAFFC.2016.2554118","U.S. Department of Health and Human Services(grant numbers:HHS 90TR0003/01); ","https://ieeexplore.ieee.org/stamp/stamp.jsp?arnumber=7452588","Tele-monitoring;mHealth;intervention;heart failure","Monitoring;Medical services;Biomedical monitoring;Real-time systems;Global Positioning System;Servers;Heart","","41","","28","IEEE","14 Apr 2016","","","IEEE","IEEE Journals"
"Toward an mHealth Intervention for Smoking Cessation","G. M. T. Ahsan; I. D. Addo; S. I. Ahamed; D. Petereit; S. Kanekar; L. Burhansstipanov; L. U. Krebs","Marquette University, Milwaukee, WI, USA; Marquette University, Milwaukee, WI, USA; Marquette University, Milwaukee, WI, USA; Rapid City Regional Hospital, Rapid, SD, USA; Rapid City Regional Hospital, Rapid, SD, USA; Native American Cancer Initiatives, USA; Native American Cancer Initiatives, USA","2013 IEEE 37th Annual Computer Software and Applications Conference Workshops","23 Sep 2013","2013","","","345","350","The prevalence of tobacco dependence in the United States (US) remains alarming. Invariably, smoke-related health problems are the leading preventable causes of death in the US. Research has shown that a culturally tailored cessation counseling program can help reduce smoking and other tobacco usage. In this paper, we present a mobile health (mHealth) solution that leverages the Short Message Service (SMS) or text messaging feature of mobile devices to motivate behavior change among tobacco users. Our approach implements the Theory of Planned Behavior (TPB) and a phase-based framework. We make contributions to improving previous mHealth intervention approaches by delivering personalized and evidence-based motivational SMS messages to participants. Our proposed solution implements machine learning algorithms that take the participant's demographic profile and previous smoking behavior into account. We discuss our preliminary evaluation of the system against a couple of pseudo-scenarios and our observation of the system's performance.","","978-1-4799-2159-1","10.1109/COMPSACW.2013.61","","https://ieeexplore.ieee.org/stamp/stamp.jsp?arnumber=6605814","Theory of Planned Behavior;Phase-based avior;Phase-based Framework;Smoking cessation;mHealth","Mobile handsets;Mobile communication;Communities;Engines;Machine learning algorithms;Medical services;Logic gates","","12","","12","IEEE","23 Sep 2013","","","IEEE","IEEE Conferences"
"Vision: Mobile eHealth Learning and Intervention Platform","M. Abdelrazek; J. Grundy; A. Ibrahim; A. Cain","School of Information Technology, Deakin University, Melbourne, Australia; School of Information Technology, Deakin University, Melbourne, Australia; School of Information Technology, Deakin University, Melbourne, Australia; Faculty of Information Technology, Monash University, Melbourne, Australia","2018 IEEE/ACM 5th International Conference on Mobile Software Engineering and Systems (MOBILESoft)","22 Nov 2018","2018","","","252","256","Face-to-face health educational and intervention programs are helpful in addressing mental and physical illness challenges in focused groups. However, these programs are expensive, resource-intensive and struggle with scalability and reachability, leading to limited take-up and short-term impact. Digital Health Intervention (DHI) programs incorporate the use of technology - mobile, web, wearables, virtual and augmented reality - to address these limitations while being more cost-effective. DHIs have shown major success in improving physical and mental health outcomes for the general public as well as reducing adverse outcomes or high-risk groups. However, it is still very challenging and expensive to design and run high quality mobile-based DHI programs, in part due to the lack of technical skills of researchers in this field. Our proposed mobile eHealth Learning and Intervention Platform (eHeLP) aims to address these challenges with a novel approach that allows health researchers to focus on their studies, and participants to have access to multiple health programs that meet their needs. The platform caters for identified stakeholders in the DHI field and encourages the development of a new health-tech industry. We present our vision eHeLP, why this idea is worth further research, risks we perceive, and next steps.","","978-1-4503-5712-8","","","https://ieeexplore.ieee.org/stamp/stamp.jsp?arnumber=8543461","mHealth;Digitial Health Intervention;eHealth Marketplace;Health Analytics","Electronic healthcare;Data collection;Stakeholders;Ecosystems;Diseases;Australia;Industries","","","","23","","22 Nov 2018","","","IEEE","IEEE Conferences"
"MORF: A Mobile Health-Monitoring Platform","R. Benlamri; L. Docksteader","MORF health-monitoring system, Lakehead University, Canada; Software Engineering Department, Lakehead University, Canada","IT Professional","18 May 2010","2010","12","3","18","25","The Mobile Ontology-based Reasoning and Feedback (MORF) health-monitoring system seamlessly integrates vital data from various health sensors to identify a patient's health status. The system can then take appropriate measures for timely support.","1941-045X","","10.1109/MITP.2010.3","","https://ieeexplore.ieee.org/stamp/stamp.jsp?arnumber=5401151","Healthcare monitoring;telemedicine;mobile computing;Semantic Web;ontology-based reasoning;ubiquitous computing;context modeling;information technology;mobile/wireless","Patient monitoring;Biomedical monitoring;Blood pressure;Heart rate;Wearable sensors;Sensor systems;Hospitals;Temperature sensors;Frequency measurement;Computerized monitoring","","28","","7","IEEE","29 Jan 2010","","","IEEE","IEEE Magazines"
"The Passive Sensing Agent: A Multimodal Adaptive mHealth Application","S. Mozgai; A. Hartholt; A. Rizzo","Institute for Creative Technologies, University of Southern California, Playa Vista, USA; Institute for Creative Technologies, University of Southern California, Playa Vista, USA; Institute for Creative Technologies, University of Southern California, Playa Vista, USA","2020 IEEE International Conference on Pervasive Computing and Communications Workshops (PerCom Workshops)","4 Aug 2020","2020","","","1","3","We are demoing the Passive Sensing Agent (PSA), an mHealth virtual human coach, that collects multimodal data through passive sensors native to popular wearables (e.g., Apple Watch, FitBit, and Garmin). This virtual human interface delivers adaptive multi-media content via smartphone application that is specifically tailored to the user in the interdependent domains of physical, cognitive, and emotional health. Initially developed for the military, the PSA delivers health interventions (e.g., educational exercises, physical challenges, and performance feedback) matched to the individual user via novel adaptive logic-based algorithms while employing various behavior change techniques (e.g., goal-setting, barrier identification, rewards, modeling, etc.). A virtual human coach leads all interactions including the first-time user experience and the brief daily sessions. All interactions were specifically designed to engage and motivate the user while continuously collecting data on their cognitive, emotional, and physical fitness. This multi-component application is integrated and deployed on an iPhone and Apple Watch prototype; a civilian version is currently in-development.","","978-1-7281-4716-1","10.1109/PerComWorkshops48775.2020.9156177","","https://ieeexplore.ieee.org/stamp/stamp.jsp?arnumber=9156177","mHealth;wearables;adaptive interventions;passive sensing;virtual human user interface","Monitoring;Mobile handsets;Biomedical monitoring;Hardware;Wearable sensors;Real-time systems","","4","","18","IEEE","4 Aug 2020","","","IEEE","IEEE Conferences"
"Modeling Messaging Metadata to Identify Digital Disagreements among Non-incarcerated Adolescents in the Juvenile Justice System","H. Pandey; C. Rizzo; C. Collibee; A. Sathyanarayana","Khoury College of Computer Sciences, Northeastern University, Boston, USA; Bouvé College of Health Sciences, Northeastern University, Boston, USA; Warren Alpert Medical School, Brown University, Providence, USA; Bouvé College of Health Sciences & Khoury College of Computer Sciences, Northeastern University, Boston, USA","2023 11th International Conference on Affective Computing and Intelligent Interaction (ACII)","15 Jan 2024","2023","","","1","8","The psychological wellbeing of adolescents, including their relationships with their parents and friends, is highly affected by romantic relationship conflict. At-risk youth - who are involved with the juvenile justice system and are especially vulnerable to aggression, defiance, and behavioral problems - experience relationship conflict at rates that exceed those of youth in the community. The pervasive usage of mobile technology by adolescents provides unprecedented data on their social interactions, communication patterns, and romantic relationship conflicts; as well as an opportunity to develop timely interventions to improve their wellbeing. This study investigates the potential of utilizing text messaging metadata from conversations with parental figures, friends, and other social connections for scalable early identification of moments of disagreement in romantic relationships in non-incarcerated, justice-involved youth. We utilize changepoint detection on text message metadata across various relationships, including the number of messages, length of messages, and response time, to identify changes in communication patterns across hours, days, and weeks, to estimate the day of a romantic disagreement. When comparing our predicted disagreement times to the current standard of intervention delivery, at random, we found statistically significant improvements in predicting disagreements with romantic partners. Our findings demonstrate that messaging metadata can effectively identify moments of disagreement in adolescents, and can be used for the delivery of just-in-time interventions for high-risk adolescents.","2156-8111","979-8-3503-2743-4","10.1109/ACII59096.2023.10388170","","https://ieeexplore.ieee.org/stamp/stamp.jsp?arnumber=10388170","human-computer interaction;ubiquitous computing;law and social sciences;machine learning;mobile data;change point detection;juvenile delinquents","Affective computing;Computational modeling;Psychology;Oral communication;Metadata;Electronic messaging;Time factors","","","","19","IEEE","15 Jan 2024","","","IEEE","IEEE Conferences"
"Mobile Education for Asthmatic Patients: Investigating the Impact of Mobile App-Based Interventions on Quality of Life","A. A. Sari; T. A. Mutiara E","Faculty of Medicines and Health Sciences, School of Pharmacy, Universitas Muhammadiyah Yogyakarta, Yogyakarta, Indonesia; Faculty of Medicines and Health Sciences, School of Pharmacy, Universitas Muhammadiyah Yogyakarta, Yogyakarta, Indonesia","2023 3rd International Conference on Emerging Smart Technologies and Applications (eSmarTA)","31 Oct 2023","2023","","","1","6","Asthma, a chronic inflammatory airway disease that leads to bronchial hyperreactivity, frequently causes a decline in quality of life, exacerbation of symptoms, and limitations in daily activities. Although asthma is intractable, its severity can be controlled through education and, more recently, the innovative use of mobile phone apps. In Indonesia, however, research on the impact of such apps on asthma patient's quality of life is limited. This non-experimental study sought to comprehend asthma patients' living conditions and determine if mobile phone app-based education could improve their quality of life. The survey was conducted between August and December 2022, with a total sample size of 40 participants based on the study's criteria. The Mini AQLQ questionnaire was used to collect data before and after the provision of education, and Wilcoxon hypothesis testing was used to analyze the data. 55% of participants initially had a poor quality of life, while 45% had an excellent quality of life. The high quality of life group increased to 62.5% after education, while the poor quality of life group decreased to 37.5%. The statistical analysis revealed that participant's average and median scores increased from the pre-test to the post-test. The Wilcoxon test yielded a p-value of 0.022, indicating a statistically significant difference between pre-test and post-test quality of life scores. Therefore, this study concludes that smartphone-based education can improve asthma patients' quality of life.","","979-8-3503-0533-3","10.1109/eSmarTA59349.2023.10293313","","https://ieeexplore.ieee.org/stamp/stamp.jsp?arnumber=10293313","attitudes;knowledge;perception;telepharmacy;young pharmacist","Surveys;Statistical analysis;Education;Mobile handsets;Asthma;Testing;Diseases","","","","40","IEEE","31 Oct 2023","","","IEEE","IEEE Conferences"
"Towards Personalized Feedback as an Energizer: A Randomized Controlled Trial","F. Lambusch; O. Weigelt; M. Fellmann; J. Fischer; A. -K. Kiechle","Business Information Systems, University of Rostock, Rostock, Germany; Wilhelm Wundt Institute of Psychology, Leipzig University, Leipzig, Germany; Business Information Systems, University of Rostock, Rostock, Germany; Work and Organizational Psychology, University of Hagen, Hagen, Germany; Work and Organizational Psychology, University of Hagen, Hagen, Germany","2023 IEEE 25th Conference on Business Informatics (CBI)","25 Jul 2023","2023","","","1","9","Higher levels of personal energy are related to higher well-being, productivity, creativity, and better mental health. Thus, systems supporting employees to self-manage their energy at work might be a straightforward instrument of sustainable health promotion and performance maintenance. However, assistance for energy self-management is still in its infancy and requires further research on energy trajectories, individual factors involved, and the implications for behavioral recommendations. In order to investigate day-to-day fluctuations, experience sampling is a common assessment instrument. In recent years, experience sampling researchers have begun to provide their participants personalized feedback reports. Mostly, however, feedback only serves to motivate participation and is therefore provided at the end of a study. Accordingly, the potential benefits inherent in the personalized feedback on phenomena still being investigated are understudied. Taking into account individual variability, we developed personalized feedback on energy trajectories and associated behaviors. This feedback is automatically created from the self-reported data of each participant during daily diaries. We conducted a comprehensive randomized controlled study across four weeks with a sample of 136 employees from diverse occupational contexts to evaluate the effectiveness of this personalized feedback. Our analyses show promising opportunities for utilizing feedback to benefit experienced energy and for deepening research in IT-supported energy self-management.","2378-1971","979-8-3503-1515-8","10.1109/CBI58679.2023.10187545","","https://ieeexplore.ieee.org/stamp/stamp.jsp?arnumber=10187545","energetic activation;experience sampling methodology;IT-based intervention;personalized feedback","Productivity;Fluctuations;Instruments;Mental health;Maintenance engineering;Trajectory;Behavioral sciences","","1","","50","IEEE","25 Jul 2023","","","IEEE","IEEE Conferences"
"eSano – An eHealth Platform for Internet- and Mobile-based Interventions","R. Kraft; A. R. Idrees; L. Stenzel; T. Nguyen; M. Reichert; R. Pryss; H. Baumeister","Department of Clinical Psychology and Psychotherapy, Ulm University, Germany; Department of Clinical Psychology and Psychotherapy, Ulm University, Germany; Department of Clinical Psychology and Psychotherapy, Ulm University, Germany; Department of Clinical Psychology and Psychotherapy, Ulm University, Germany; Institute of Databases and Information Systems, Ulm University, Germany; Institute of Clinical Epidemiology and Biometry, University of Würzburg, Germany; Department of Clinical Psychology and Psychotherapy, Ulm University, Germany","2021 43rd Annual International Conference of the IEEE Engineering in Medicine & Biology Society (EMBC)","9 Dec 2021","2021","","","1997","2002","The prevention and treatment of mental disorders and chronic somatic diseases is a core challenge for health care systems of the 21th century. Mental- and behavioral health interventions provide the means for lowering the public health burden. However, structural deficits, reluctance to use existing services, perceived stigma and further personal and environmental reasons restrict the uptake of these evidence-based approaches. Internet- and mobile-based interventions (IMIs) might overcome some of the limitations of on-site interventions by providing an anonymous, scalable, time- and location-independent, yet evidence-based approach. In order to implement digital mental and behavioral health concepts across the life-span into practice, a technical solution to support the design, creation, and execution of IMIs is needed. However, there are various conceptual, technical as well as legal challenges to implementing a corresponding software solution in the healthcare domain. Therefore, the work at hand (1) identifies these challenges and derives a number of respective requirements, (2) introduces the eHealth platform eSano, a software project developed by an interdisciplinary team of computer scientists, psychologists, therapists, and other domain experts, with the aim to serve as a flexible basis for mental and behavioral research and health care, and (3) provides technical insights into the developed platform and its approach to address the aforementioned requirements.","2694-0604","978-1-7281-1179-7","10.1109/EMBC46164.2021.9629534","","https://ieeexplore.ieee.org/stamp/stamp.jsp?arnumber=9629534","","Law;Mental disorders;Psychology;Software;Biology;Electronic healthcare;Public healthcare","Chronic Disease;Humans;Internet;Mental Disorders;Telemedicine","6","","28","IEEE","9 Dec 2021","","","IEEE","IEEE Conferences"
"Social Isolation and Serious Mental Illness: The Role of Context-Aware Mobile Interventions","S. Nepal; A. Pillai; E. M. Parrish; J. Holden; C. Depp; A. T. Campbell; E. L. Granholm","Dartmouth College, Hanover, NH, USA; Dartmouth College, Hanover, NH, USA; San Diego State University/University of California San Diego Joint Doctoral Program in Clinical Psychology, San Diego, CA, USA; University of California San Diego, San Diego, CA, USA; University of California San Diego, San Diego, CA, USA; Dartmouth College, Hanover, NH, USA; University of California San Diego, San Diego, CA, USA","IEEE Pervasive Computing","4 Jun 2024","2024","23","1","46","56","Social isolation is a common problem faced by individuals with serious mental illness (SMI), and current intervention approaches have limited effectiveness. This article presents a blended intervention approach, called mobile Social Interaction Therapy by Exposure, to address social isolation in individuals with SMI. The approach combines brief in-person cognitive-behavioral therapy (CBT) with context-triggered mobile CBT interventions that are personalized using mobile sensing data. Our approach targets social behavior and is the first context-aware intervention for improving social outcomes in SMI.","1558-2590","","10.1109/MPRV.2024.3377200","","https://ieeexplore.ieee.org/stamp/stamp.jsp?arnumber=10485570","","Sensors;Oral communication;Mental health;Medical treatment;Anxiety disorders;Global Positioning System;Smart phones","","","","20","IEEE","29 Mar 2024","","","IEEE","IEEE Magazines"
