"Document Title",Authors,"Author Affiliations","Publication Title",Date Added To Xplore,"Publication Year","Volume","Issue","Start Page","End Page","Abstract","ISSN",ISBNs,"DOI",Funding Information,PDF Link,"Author Keywords","IEEE Terms","Mesh_Terms",Article Citation Count,Patent Citation Count,"Reference Count","License",Online Date,Issue Date,"Meeting Date","Publisher",Document Identifier
"Towards Multi-level Modeling of Just-in-Time Adaptive Interventions (JITAIs) in Mobile Health","S. Gruber; B. Neumayr; M. Schrefl; J. Niebauer","Ludwig Boltzmann Institute for Digital Health and Prevention, Salzburg, Austria; Institute of Business Informatics - Data & Knowledge Engineering, Johannes Kepler University Linz, Linz, Austria; Institute of Business Informatics - Data & Knowledge Engineering, Johannes Kepler University Linz, Linz, Austria; Ludwig Boltzmann Institute for Digital Health and Prevention, Salzburg, Austria","2021 ACM/IEEE International Conference on Model Driven Engineering Languages and Systems Companion (MODELS-C)","20 Dec 2021","2021","","","541","545","The just-in-time adaptive intervention (JITAI) is an intervention design for supporting health behavior changes of an individual especially via mobile technologies. In this position paper we discuss JITAIs as a multi-level modeling problem focusing on the structure of multi-level JITAI models. JITAIs are designed on a generic level, configured for studies, personalized for participants, and evaluated at particular points in time. In this paper we model the multi-level structure of JITAI studies using composition and association classes. We sketch how to transform such models to multi-level models aligned with the multi-level theory. Finally, we discuss challenges and requirements for JITAI systems related to multi-level modeling.","","978-1-6654-2484-4","10.1109/MODELS-C53483.2021.00084","","https://ieeexplore.ieee.org/stamp/stamp.jsp?arnumber=9643765","personalized real-time intervention;materialization;multi-level theory;structure of multi-level models","Semantic Web;Knowledge engineering;Adaptation models;Unified modeling language;Transforms;Real-time systems;Model driven engineering","","","","25","IEEE","20 Dec 2021","","","IEEE","IEEE Conferences"
"A Highly Configurable EMA and JITAI Mobile App Framework Utilized in a Large-Scale German Study on Breast Cancer Aftercare","C. Vogel; E. Bendig; P. Garatva; L. Stenzel; A. R. Idrees; R. Kraft; H. Baumeister; R. Pryss","Institute of Clinical Epidemiology and Biometry, University of Würzburg, Würzburg, Germany; Department of Clinical Psychology and Psychotherapy, Ulm University, Ulm, Germany; Department of Clinical Psychology and Psychotherapy, Ulm University, Ulm, Germany; Department of Clinical Psychology and Psychotherapy, Ulm University, Ulm, Germany; Department of Clinical Psychology and Psychotherapy, Ulm University, Ulm, Germany; Department of Clinical Psychology and Psychotherapy, Ulm University, Ulm, Germany; Department of Clinical Psychology and Psychotherapy, Ulm University, Ulm, Germany; Institute of Clinical Epidemiology and Biometry, University of Würzburg, Würzburg, Germany","2023 IEEE 36th International Symposium on Computer-Based Medical Systems (CBMS)","17 Jul 2023","2023","","","103","110","A growing number of observational studies are utilizing the advances of mobile technology. In addition to diverse strategies such as digital phenotyping, ecological momentary assessments (EMA) or mobile Crowdsensing, intervention studies are becoming increasingly relevant in this context. More specifically, Just-in-Time Adaptive Interventions (JITAIs) appear to be a key component in mobile health for behavioral support, aimed at providing the proper kind of aid at the right time by dynamically adapting to a person's changing condition. Fully or partially electronically supported treatments can relieve the health system and bridge or shorten the waiting time for treatments for patients. In this work we combine our technical expertise with the theoretical foundations of JITAIs in an interdisciplinary collaboration to facilitate the appropriate use of theory in building JITAIs in a dynamic system. As a result, we present a highly configurable, generic and modular EMA and JITAI mobile framework which enabled us to generate a cross-platform breast cancer aftercare mobile app in a large-scale German study. The aim is to learn more about the validity, usefulness and feasibility of such mobile-device-assisted studies, taking into account administrative burden as well as user acceptance. We discuss the background, implementation, and whether these features could leverage similar study types in the future to overcome the static nature of existing behavioral and interventional apps.","2372-9198","979-8-3503-1224-9","10.1109/CBMS58004.2023.00200","","https://ieeexplore.ieee.org/stamp/stamp.jsp?arnumber=10178839","mHealth;Ecological Momentary Assessment;Just-In- Time Adaptive Intervention;Breast Cancer Aftercare","Bridges;Adaptive systems;Crowdsensing;Buildings;Collaboration;Breast cancer;Mobile applications","","","","39","IEEE","17 Jul 2023","","","IEEE","IEEE Conferences"
"The Design of Ecological Momentary Assessment Technologies","K. Doherty; A. Balaskas; G. Doherty","School of Computer Science and Statistics, Trinity College Dublin, Dublin 2, Ireland; Copenhagen Center for Health Technology, Technical University of Denmark, Lyngby, Copenhagen, Denmark; School of Computer Science and Statistics, Trinity College Dublin, Dublin 2, Ireland; School of Computer Science and Statistics, Trinity College Dublin, Dublin 2, Ireland; Gavin.Doherty@tcd.ie","Interacting with Computers","18 May 2021","2020","32","1","257","278","Ecological Momentary Assessment (EMA) methods and technologies, designed to support the self-report of experience in the moment of daily life, have long been considered poised to revolutionize human-centred research, the practice of design and mental healthcare. The history of EMA is inextricably linked to technology, and mobile devices embody many of the characteristics required to support these methods. However, significant barriers to the design and adoption of these systems remain, including challenges of user engagement, reporting burden, data validity and honest disclosure. While prior research has examined the feasibility of a variety of EMA systems, few reviews have attended to their design. Through inter-disciplinary narrative literature review (n = 342), this paper presents a characterization of the EMA technology design space, drawing upon a diverse set of literatures, contexts, applications and demographic groups. This paper describes the options and strategies available to the EMA systems designer, with an eye towards supporting the design and deployment of EMA technologies for research and clinical practice.","1873-7951","","10.1093/iwcomp/iwaa019","","https://ieeexplore.ieee.org/stamp/stamp.jsp?arnumber=9434231","ecological momentary assessment;ecological momentary intervention;experience sampling;ambulatory assessment;mental health;EMA;engagement","","","3","","","","18 May 2021","","","OUP","OUP Journals"
"Adaptive Symptom Monitoring Using Hidden Markov Models – An Application in Ecological Momentary Assessment","W. J. Hulme; G. P. Martin; M. Sperrin; A. J. Casson; S. Bucci; S. Lewis; N. Peek","Centre for Health Informatics, Division of Informatics, Imaging and Data Science, School of Health Sciences, University of Manchester, Manchester, U.K.; Centre for Health Informatics, Division of Informatics, Imaging and Data Science, School of Health Sciences, University of Manchester, Manchester, U.K.; Centre for Health Informatics, Division of Informatics, Imaging and Data Science, School of Health Sciences, University of Manchester, Manchester, U.K.; Division of Materials, Devices and Systems, School of Electrical and Electronic Engineering, University of Manchester, Manchester, U.K.; Division of Psychology and Mental Health, School of Health Sciences, University of Manchester, Manchester, U.K.; Division of Psychology and Mental Health, School of Health Sciences, University of Manchester, Manchester, U.K.; Centre for Health Informatics, Division of Informatics, Imaging and Data Science, School of Health Sciences, University of Manchester, Manchester, U.K.","IEEE Journal of Biomedical and Health Informatics","11 May 2021","2021","25","5","1770","1780","Wearable and mobile technology provides new opportunities to manage health conditions remotely and unobtrusively. For example, healthcare providers can repeatedly sample a person's condition to monitor progression of symptoms and intervene if necessary. There is usually a utility-tolerability trade-off between collecting information at sufficient frequencies and quantities to be useful, and over-burdening the user or the underlying technology, particularly when active input is required from the user. Selecting the next sampling time adaptively using previous responses, so that people are only sampled at high frequency when necessary, can help to manage this trade-off. We present a novel approach to adaptive sampling using clustered continuous-time hidden Markov models. The model predicts, at any given sampling time, the probability of moving to an `alert' state, and the next sample time is scheduled when this probability has exceeded a given threshold. The clusters, each representing a distinct sub-model, allow heterogeneity in states and state transitions. The work is illustrated using longitudinal mental-health symptom data in 49 people collected using ClinTouch, a mobile app designed to monitor people with a diagnosis of schizophrenia. Using these data, we show how the adaptive sampling scheme behaves under different model parameters and risk thresholds, and how the average sampling can be substantially reduced whilst maintaining a high sampling frequency during high-risk periods.","2168-2208","","10.1109/JBHI.2020.3031263","Engineering and Physical Sciences Research Council(grant numbers:EP/P010148/1); ","https://ieeexplore.ieee.org/stamp/stamp.jsp?arnumber=9226077","mHealth;ecological momentary assessment;ecological momentary intervention;digital phenotyping;hidden Markov models;risk prediction;schizophrenia;adaptive sampling","Hidden Markov models;Monitoring;Adaptation models;Biomedical monitoring;Informatics;Real-time systems;Markov processes","Ecological Momentary Assessment;Humans;Mental Health;Mobile Applications;Monitoring, Physiologic;Schizophrenia","8","","39","IEEE","15 Oct 2020","","","IEEE","IEEE Journals"
"Is providing mobile interventions ""just-in-time"" helpful? an experimental proof of concept study of just-in-time intervention for stress management","Smyth; Heron","The Pennsylvania State University, University Park, PA, USA; Old Dominion University and the Virginia Consortium Program in Clinical Psychology, Norfolk, VA, USA","2016 IEEE Wireless Health (WH)","15 Dec 2016","2016","","","1","7","Although there is growing interest in using mHealth approaches to provide just-in-time [JIT] intervention elements tailored to current emotional states in real time, critical evidentiary questions remain unanswered. This study was a ‘proof of concept’ evaluation to see if, in the context of a manualized stress management program, adding JIT intervention reminders via mobile technology would enhance outcomes more than the provision of random (untailored) reminders (both also relative to a measurement only active control condition). Individuals participated in a stress management course and carried a palmtop computer for 11 days (2 days acclimation and assessment, 1 week intervention, and 2 days post-treatment assessment). For the intervention week participants were assigned to one of three groups and either: (a) only completed self-report assessments multiple times each data (using ecological momentary assessment [EMA]; (b) completed EMA and received random reminders to use stress management skills; (c) completed EMA and received JIT tailored reminders to use stress management intervention elements when high stress or negative affect were reported. Individuals receiving JIT reminders reported stressful events less frequently, lower stress severity, less negative affect, lower levels of a stress biomarker (cortisol), less frequent eating, less alcohol consumption, less smoking and better sleep quality than the other two groups at post-treatment assessment. Tailored mHealth interventions designed in conjunction with ambulatory assessment protocols to provide JIT intervention elements can improve the efficacy of a standard stress intervention above and beyond any effects of simple reminders or over the intervention training. Implications for mHealth and JIT interventions are discussed.","","978-1-5090-3090-3","10.1109/WH.2016.7764561","","https://ieeexplore.ieee.org/stamp/stamp.jsp?arnumber=7764561","","Stress;Mobile communication;Mood;Training;Mobile handsets;Appraisal;Atmospheric measurements","","41","","32","IEEE","15 Dec 2016","","","IEEE","IEEE Conferences"
"Just in time Intervention for Personalized Healthcare: Behavior-Context based Intervention Adaptation","H. S. Muhammad Bilal; U. Akhtar; S. W. Chul; S. Lee","Department of Computer Science and Engineering, Kyung Hee University, Yongin-si, South Korea; Department of Computer Science and Engineering, Kyung Hee University, Yongin-si, South Korea; Department of Neurology, Kyung Hee University Hospital, Gangdong-gu, South Korea; Department of Computer Science and Engineering, Kyung Hee University, Yongin-si, South Korea","2020 International Conference on Information Networking (ICOIN)","2 Mar 2020","2020","","","64","69","Advanced computing has provided the foundation for the self-assessment of lifestyle and change the unhealthy habits. The focus of healthcare industry has been shifted to adopt healthy lifestyle for improvement of life quality and span. Currently, the main concern of the wellness applications is to support user with personalization and self-quantification. The challenge is not only to indicate the unhealthy behavior just in time but also adapt it step-by-step through the realization of behavior change theories. Our proposed methodology focuses on the behavior-context for adopting the appropriate way of intervention for actionable behavior. Initially, lifelog and questionnaire based qualitative assessment of behavior is performed for the identification of behavior-context and status. Behavior-context wise intervention is provided to adapt behavior in actionable manner. The interventions are in the form of personalized education, and context-based just-in-time recommendations with enhanced impact through analysis of unhealthy factors of lifestyle. The healthy behavior index supports the quantifications and mapping of behavior-context and status to drive the interventions along with analysis of the change in behavior. The theory and index related to behavior have enhanced the applicability of wellness management system through behavior status sketching to adopt healthy lifestyle. The results represent that behavior-context based intervention are more responsive and improve the lifestyle.","1976-7684","978-1-7281-4199-2","10.1109/ICOIN48656.2020.9016632","","https://ieeexplore.ieee.org/stamp/stamp.jsp?arnumber=9016632","Behavior-context;Just-in-time intervention;lifestyle habits;recommendations;wellness services;noncommunicable diseases","Indexes;Diseases;Computer science;Sugar;Education;Organizations","","1","","14","IEEE","2 Mar 2020","","","IEEE","IEEE Conferences"
"Usage and Effect of a Web-Based Intervention for the Prevention of Overweight; a Randomized Controlled Trial","S. M. Kelders; J. E. W. C. van Gemert-Pijnen; A. Werkman; E. R. Seydel","National Institute for Public Health and the Environment, Bilthoven, The Netherlands; Universiteit Twente, Enschede, Overijssel, NL; Netherlands Nutrition Centre, Den Haag, The Netherlands; University of Twente, Enschede, The Netherlands","2010 Second International Conference on eHealth, Telemedicine, and Social Medicine","18 Mar 2010","2010","","","113","118","Web-based interventions can be effective in changing behaviour of people faced with health problems. However, it is unclear whether they are effective in preventing health problems like overweight. The aim of this study was to investigate usage and effectiveness of a web-based application to increase healthy behaviour in adults with a healthy weight or slight overweight (BMI 18-28 kg/m2) by means of a Randomized Controlled Trial. A total of 297 respondents were randomly assigned to the intervention (n=147) or the waiting list group (n=150). The intervention group received access to the intervention for 12 weeks. At pre- and post-test we measured dietary and physical activity behaviour (primary outcomes) and BMI, knowledge, attitude, self-efficacy, subjective behaviour and insight in behaviour (secondary outcomes). All participants, regardless of randomized group, show improvement in healthy behaviour and subjective assessment of healthy behaviour. People who are older, score higher on dietary behaviour and under-estimate their dietary behaviour are more likely to use the Healthy Weight Assistant (HWA). Using the HWA leads to improvement in physical activity behaviour and insight in this behaviour. Trial Registration: ISRCTN42687923.","","978-1-4244-5804-2","10.1109/eTELEMED.2010.22","","https://ieeexplore.ieee.org/stamp/stamp.jsp?arnumber=5432852","prevention;RCT;usage;eHealth;intervention","Current measurement;Gain measurement;Telemedicine;Public healthcare;Instruments;Diabetes;Medical services;Internet","","1","","25","IEEE","18 Mar 2010","","","IEEE","IEEE Conferences"
"Personalized technology for supporting health behaviors","S. C. Wangberg; C. Psychol","Department of Health and Society, University College of Narvik, Norway; Department of Health and Society, University College of Narvik, Norway","2013 IEEE 4th International Conference on Cognitive Infocommunications (CogInfoCom)","23 Jan 2014","2013","","","339","344","Previous work within health communication has been concerned with how to tailor intervention content in a way that is most effective in supporting the individual in changing health behaviors such as smoking, physical activity or diet. This kind of tailoring is based on data gathered from the user through questionnaires with textual feedback adapted by algorithms pre-specified according to behavioral theory. The Internet opened up for a new generation of tailored interventions that were more sophisticated, more synchronous and more longitudinal. In the current paper I present the results of a scoping review to explore literature relevant to how the third generation of tailored interventions might look like, using sensors embedded in commonly available ICT such as PCs and smartphones and machine learning for tailoring these kinds of interventions in real time, thus becoming cognitive infocommunications (CogInfoCom) applications that enhance the human brain. The main aim of the paper is to inspire further multidisciplinary research and development on addressing the important topic of supporting the individual in changing and maintaining health behaviors.","","978-1-4799-1546-0","10.1109/CogInfoCom.2013.6719267","","https://ieeexplore.ieee.org/stamp/stamp.jsp?arnumber=6719267","Health Behavior;Internet-Based Interventions;mHealth;Tailoring;Personalization;Attention;Eye-tracking;EDA;Machine Learning","Sensors;Heart rate;Internet;Real-time systems;Conferences;Educational institutions;Computers","","1","","50","IEEE","23 Jan 2014","","","IEEE","IEEE Conferences"
"An Architectural Design for Self-Reporting E-Health Systems","S. K. Mukhiya; F. Rabbi; K. I. Pun; Y. Lamo","Western Norway University of Applied Sciences, Norway; Western Norway University of Applied Sciences, Norway; Western Norway University of Applied Sciences, Norway; Western Norway University of Applied Sciences, Norway","2019 IEEE/ACM 1st International Workshop on Software Engineering for Healthcare (SEH)","5 Sep 2019","2019","","","1","8","Worldwide, public healthcare is challenged to deliver consistent and cost-efficient services. The cost of healthcare is increasing primarily due to growing populations and more expensive treatment. Health facilities in many countries are reaching their full operational capacity, and their resources %of these hospitals are less than what is required to deliver the expected quality of care. Under these circumstances, ICT has a major role to play in mitigating the growing need for hospital care. In this paper, we present a cloud-based interoperable architecture built on the top of Service-Oriented Architecture (SOA) for Internet-based treatment where patients can directly interact with underlying healthcare systems such as Electronic Health Records (EHRs). Based on this architecture, we also present a prototype for screening and monitoring of mental and neurological health morbidities. The proposed solution is based on the healthcare interoperability standard, HL7 FHIR, that enables healthcare providers to assess and monitor patients condition in a secure environment.","","978-1-7281-2251-9","10.1109/SEH.2019.00008","","https://ieeexplore.ieee.org/stamp/stamp.jsp?arnumber=8823897","service-oriented architecture, healthcare, self-screening, HL7 FHIR, SMART on FHIR, Internet-based Treatments","Medical services;Monitoring;Service-oriented architecture;Servers;Authorization;Standards;Interoperability","","12","","45","IEEE","5 Sep 2019","","","IEEE","IEEE Conferences"
"UNITI Mobile—EMI-Apps for a Large-Scale European Study on Tinnitus","C. Vogel; J. Schobel; W. Schlee; M. Engelke; R. Pryss","Institute of Clinical Epidemiology and Biometry, University of Würzburg, Würzburg, Germany; Institute DigiHealth, University of Applied Sciences, Neu-Ulm, Germany; Department of Psychiatry and Psychotherapy, University of Regensburg, Regensburg, Germany; Department of Psychiatry and Psychotherapy, University of Regensburg, Regensburg, Germany; Institute of Clinical Epidemiology and Biometry, University of Würzburg, Würzburg, Germany","2021 43rd Annual International Conference of the IEEE Engineering in Medicine & Biology Society (EMBC)","9 Dec 2021","2021","","","2358","2362","More and more observational studies exploit the achievements of mobile technology to ease the overall implementation procedure. Many strategies like digital phenotyping, ecological momentary assessments or mobile crowdsensing are used in this context. Recently, an increasing number of intervention studies makes use of mobile technology as well. For the chronic disorder tinnitus, only few long-running intervention studies exist, which use mobile technology in a larger setting. Tinnitus is characterized by its heterogeneous patient’s symptom profiles, which complicates the development of general treatments. In the UNITI project, researchers from different European countries try to unify existing treatments and interventions to cope with this heterogeneity. One study arm (UNITI Mobile) exploits mobile technology to investigate newly implemented interventions types, especially within the pan-European setting. The goals are to learn more about the validity and usefulness of mobile technology in this context. Furthermore, differences among the countries shall be investigated. Practically, two native intervention apps have been developed for UNITI and the mobile study arm, which pose features not presented so far in other apps of the authors. Along the implementation procedure, it is discussed whether these features might leverage similar types of studies in future. Since instruments like the mHealth evidence reporting and assessment checklist (mERA), developed by the WHO mHealth technical evidence review group, indicate that aspects shown for UNITI Mobile are important in the context of health interventions using mobile phones, our findings may be of a more general interest and are therefore being discussed in the work at hand.","2694-0604","978-1-7281-1179-7","10.1109/EMBC46164.2021.9630482","","https://ieeexplore.ieee.org/stamp/stamp.jsp?arnumber=9630482","","Crowdsensing;Instruments;Europe;Mobile handsets;Biology","Cell Phone;Ecological Momentary Assessment;Humans;Mobile Applications;Telemedicine;Tinnitus","10","","24","IEEE","9 Dec 2021","","","IEEE","IEEE Conferences"
