"Research and Application of Anomaly Detection of Bridge Data Based on Improved Transformer","X. Xu; F. Li; X. Yu; J. Yan; Z. Chen","College of Information Science and Engineering, Wuhan University of Science and Technology, Wuhan, China; College of Information Science and Engineering, Wuhan University of Science and Technology, Wuhan, China; China Railway Fourth Institute Survey and Design Institute Group Co., Ltd., Wuhan, China; China Railway Fourth Institute Survey and Design Institute Group Co., Ltd., Wuhan, China; Huazhong University of Science and Technology, Wuhan, China","2023 35th Chinese Control and Decision Conference (CCDC)","1 Dec 2023","2023","","","628","633","In the past, learning point-wise representations through recursive networks has been effective for addressing anomaly detection problems, but it has been difficult to extend to more complex temporal patterns. Transformer’s self-attention weights, on the other hand, can capture rich associations between each time point and the entire sequence. Because of the rarity of anomalies, it is difficult for anomalous points to establish associations with the entire sequence, but they tend to have close associations with neighboring regions.This difference can be leveraged to differentiate anomalies.By improving the self-attention module of the original Transformer model, we construct a Transformer model with dual-path modeling capability. Using the idea of anomaly detection based on association modeling, we perform anomaly detection on bridge data. The experimental results show that the precision reaches 91.5%. This detection method is effective in distinguishing anomalies.This paper takes the bridge of urban rail transportation in Wuhan as the background, with a large amount of data and a high demand for real-time support for the detection of numerous sensor data. After adopting the sparse attention mechanism, the time cost decreased by 10.7% while the precision did not decrease by about 1%. By combining deep learning with the time series database IoTDB, the ability to detect anomalies in time series data is improved, providing data protection for bridge safety assessment.","1948-9447","979-8-3503-3472-2","10.1109/CCDC58219.2023.10326925","National Natural Science Foundation of China; China Railway; China Railway Eryuan Engineering Group; ","https://ieeexplore.ieee.org/stamp/stamp.jsp?arnumber=10326925","Bridge Monitoring;Transformer;Anomaly Detection","Bridges;Time series analysis;Merging;Transformers;Data models;Real-time systems;Rail transportation","","","","11","IEEE","1 Dec 2023","","","IEEE","IEEE Conferences"
"OntoPeFeGe: Ontology-Based Personalized Feedback Generator","M. N. Demaidi; M. M. Gaber; N. Filer","School of Computing and Digital Technology, Birmingham City University, Birmingham, U.K.; School of Computing and Digital Technology, Birmingham City University, Birmingham, U.K.; School of Computer Science, The University of Manchester, Manchester, U.K.","IEEE Access","28 Jun 2018","2018","6","","31644","31664","Virtual Learning Environments provide teachers with a web-based platform to create different types of feedback. These environments usually follow the `one size fits all' approach and provide students with the same feedback. Several personalized feedback frameworks have been proposed which adapt the different types of feedback based on the student characteristics and/or the assessment question characteristics. The frameworks are intradisciplinary, neglect the characteristics of the assessment question, and either hard-code or auto-generate the types of feedback from a restricted set of solutions created by a domain expert. This paper contributes to research carried out on personalized feedback frameworks by proposing a generic novel system which is called the Ontology-based Personalized Feedback Generator (OntoPeFeGe). OntoPeFeGe addressed the aforementioned drawbacks using an ontology-a knowledge representation of the educational domain. It integrated several generation strategies and templates to traverse the ontology and auto-generate the questions and feedback. The questions have different characteristics, in particular, aiming to assess students at different levels in Bloom's taxonomy. Each question is associated with different types of feedback that range from verifying student's answers to giving the student more details related to the answer. The feedback auto-generated in OntoPeFeGe is personalized using a rule-based algorithm which takes into account the student characteristics and the assessment question characteristics. The personalized feedback in OntoPeFeGe was quantitatively evaluated on 88 undergraduate students. The results revealed that the personalized feedback significantly improved the performance of students with low background knowledge. In addition, the feedback was evaluated qualitatively using questionnaires provided to teachers and students. The results showed that teachers and students were satisfied with the feedback.","2169-3536","","10.1109/ACCESS.2018.2846398","","https://ieeexplore.ieee.org/stamp/stamp.jsp?arnumber=8379418","Ontology;formative feedback;Bloom’s taxonomy;question generation;feedback generation;personalized","Generators;Ontologies;Taxonomy;Knowledge based systems;Computer science;Feeds;Back","","23","","59","OAPA","11 Jun 2018","","","IEEE","IEEE Journals"
"A decision framework for an adaptive behavioral intervention for physical activity using hybrid model predictive control","C. A. Martín; D. E. Rivera; E. B. Hekler","Facultad de In-geniería en Electricidad y Computación, Escuela Superior Politécnica del Litoral, ESPOL, Guayaquil, Ecuador; Control Systems Engineering Laboratory, Arizona State University, Tempe, AZ, USA; School of Nutrition and Health Promotion, Arizona State University, Phoenix, AZ, USA","2016 American Control Conference (ACC)","1 Aug 2016","2016","","","3576","3581","Physical inactivity is a major contributor to morbidity and mortality worldwide. Many physical activity behavioral interventions at present have shown limited success addressing the problem from a long-term perspective that includes maintenance. This paper proposes the design of a decision algorithm for a mobile and wireless health (mHealth) adaptive intervention that is based on control engineering concepts. The design process relies on a behavioral dynamical model based on Social Cognitive Theory (SCT), with a controller formulation based on hybrid model predictive control (HMPC) being used to implement the decision scheme. The discrete and logical features of HMPC coincide naturally with the categorical nature of the intervention components and the logical decisions that are particular to an intervention for physical activity. The intervention incorporates an online controller reconfiguration mode that applies changes in the penalty weights to accomplish the transition between the behavioral initiation and maintenance training stages. Simulation results are presented to illustrate the performance of the controller using a hypothetical model for physical activity interventions, under realistic conditions.","2378-5861","978-1-4673-8682-1","10.1109/ACC.2016.7525468","","https://ieeexplore.ieee.org/stamp/stamp.jsp?arnumber=7525468","","Predictive control;Computational modeling;Maintenance engineering;Adaptation models;Context;Training","","16","","18","","1 Aug 2016","","","IEEE","IEEE Conferences"
"Validation of Smartphone Based Heart Rate Tracking for Remote Treatment of Panic Attacks","R. S. McGinnis; E. W. McGinnis; C. Petrillo; J. Ferri; J. Scism; M. Price","University of Vermont, Burlington, VT, USA; University of Vermont, Burlington, VT, USA; University of Vermont, Burlington, VT, USA; University of Vermont, Burlington, VT, USA; University of Vermont, Burlington, VT, USA; University of Vermont, Burlington, VT, USA","IEEE Journal of Biomedical and Health Informatics","5 Mar 2021","2021","25","3","656","662","Panic attacks are an impairing mental health problem that affects 11% of adults every year [1]. Those who suffer from panic attacks often do not seek psychological treatment, citing the inability to receive care during their attacks as a contributing factor. A digital medicine solution which provides an accessible, real-time mobile health (mHealth) biofeedback intervention for panic attacks may address this problem. Critical to this approach are methods for capturing physiological arousal during an attack. Herein, we validate an algorithm for capturing physiological arousal using smartphone video of the fingertip. Results demonstrate that the algorithm is able to estimate heart rates that are highly correlated with ECG-derived values (r > 0.99), effectively reject low-quality data often captured outside of controlled laboratory environments (AUC > 0.90), and resolve the physiological arousal experienced during a panic attack. Moreover, patient reported measures indicate that this measurement modality is feasible during panic attacks, and the act of taking the measurement may stop the attack. These results point toward the need for future development and clinical evaluation of this mHealth intervention for preventing panic attacks.","2168-2208","","10.1109/JBHI.2020.3001573","University of Vermont; ","https://ieeexplore.ieee.org/stamp/stamp.jsp?arnumber=9115216","Mental health;mHealth;biofeedback;panic attack;digital medicine","Heart rate;Physiology;Estimation;Biological control systems;Biomedical measurement;Cameras;Fingers","Adult;Anxiety;Heart Rate;Humans;Panic Disorder;Smartphone","8","","39","IEEE","11 Jun 2020","","","IEEE","IEEE Journals"
"Temporal Community Structure Patterns in Diabetes Social Networks","T. Chomutare; E. Årsand; G. Hartvigsen","Norwegian Center for Integrated Care and Telemedicine, University Hospital of North Norway, Tromso, Norway; Norwegian Center for Integrated Care and Telemedicine, University Hospital of North Norway, Tromso, Norway; Norwegian Center for Integrated Care and Telemedicine, University Hospital of North Norway, Tromso, Norway","2012 IEEE/ACM International Conference on Advances in Social Networks Analysis and Mining","4 Feb 2013","2012","","","745","750","The growing amount of data in healthcare social media requires innovative new analysis methods, which are elementary to exploration of relationship dynamics, community formation, sustenance and dissolution, in a bid to understand the new roles social media play in healthcare. In this work we use network analysis to explore the temporal nature of two large diabetes social networks, with a view to enhancing our knowledge of the development of sub-community structures and cohesion factors. Current results reveal how diabetes online communities are very dynamic, suggesting diabetes patients are usually actively engaged for periods of less than a year, typically immediately following diagnosis. The presented empirical evidence inform future online intervention strategies for promoting health behavior and lifestyle changes among people with diabetes.","","978-1-4673-2497-7","10.1109/ASONAM.2012.137","","https://ieeexplore.ieee.org/stamp/stamp.jsp?arnumber=6425670","Social networks;social network analysis;community detection;temporal graphs","Communities;Diabetes;Social network services;Instruction sets;Data mining;Indexes","","5","","24","IEEE","4 Feb 2013","","","IEEE","IEEE Conferences"
"A control engineering approach for optimizing physical activity behavioral interventions","C. A. Martín; D. E. Rivera; E. B. Hekler","Facultad de Ingeniería en Electricidad y Computación, Escuela Superior Politécnica del Litoral, Guayaquil, Ecuador; Control Systems Engineering Laboratory School for Engineering of Matter Transport, and Energy, Arizona State University, Tempe, AZ, USA; School of Nutrition and Health Promotion, Arizona State University, Phoenix, AZ, USA","2016 IEEE Ecuador Technical Chapters Meeting (ETCM)","24 Nov 2016","2016","","","1","6","This paper presents the use of control engineering principles to optimize mobile and wireless health (mHealth) adaptive behavioral interventions for physical activity based on Social Cognitive Theory (SCT). SCT is a conceptual framework that describes human behavior and has been used in many health behavior interventions. An intervention for physical activity is formulated as a control systems problem relying on a dynamical model of SCT that is developed utilizing fluid analogies. To obtain values for model parameters, system identification experiments are designed including two phases: an initial informative stage followed by an optimized stage that incorporates “patient-friendly” conditions. With the estimated model, a closed-loop intervention is formulated relying on Hybrid Model Predictive Control (HMPC). The HMPC algorithm includes a representation of categorical and discrete constraints that are inherent to behavioral interventions, and the recognition of behavioral initiation and maintenance phases. A simulation study is performed illustrating representative scenarios of the system (in both open and closed-loop).","","978-1-5090-1629-7","10.1109/ETCM.2016.7750851","","https://ieeexplore.ieee.org/stamp/stamp.jsp?arnumber=7750851","","Mathematical model;Modeling;Optimization;Switches;Electronic mail;Maintenance engineering","","3","","21","IEEE","24 Nov 2016","","","IEEE","IEEE Conferences"
"A Design of a Mobile Health System to Address Teenage Pregnancy in South African Hige Schools","P. Ndayizigamiye; S. F. Matlala","School of Management, IT and Governance, University of KwaZulu-Natal, Pietermaritzburg, South Africa; Department of Public Health, University of Limpopo","2018 IEEE Global Humanitarian Technology Conference (GHTC)","6 Jan 2019","2018","","","1","6","Teenage pregnancy is a major concern within the context of South African high (secondary) school education. This stems from the fact that in most cases, pregnant learners do not receive adequate support. Hence, learners end up hiding their pregnancies or terminating their pregnancies. This poses a serious health-related concern because if pregnancies are not nurtured at an early stage, the results therefore could be complications that may endanger the life of the pregnant learner and the unborn baby. In addition, if pregnant learners are not given adequate care, they end up dropping from school and hence jeopardizing their future careers. In South Africa, there are many interventions that cater for maternal health. However, the uptake of such interventions among secondary school learners is very minimal due to the stigma attached to falling pregnant out of the wedlock and at a very young age. On the other hand, mobile phones penetration among the youth in South Africa is high. This presents an opportunity for designing mHealth interventions targeting pregnant learners. This paper presents a preliminary design of an mHealth intervention that could help teenagers get accurate information pertaining to pregnancy-related issues and get help when needed. In addition, the intervention involves major stakeholders that should be involved in addressing teenage pregnancy issues. It is believed that this proposed mHealth intervention will be more efficient compared to other interventions provided that buy-in from all the identified stakeholders is secured.","2377-6919","978-1-5386-5566-5","10.1109/GHTC.2018.8601877","","https://ieeexplore.ieee.org/stamp/stamp.jsp?arnumber=8601877","pregnancy;teenagers;secondary school;South Africa","Pregnancy;Pediatrics;Engineering profession;Conferences;Education;Collaboration;Africa","","1","","29","IEEE","6 Jan 2019","","","IEEE","IEEE Conferences"
"Real-Time Language Assistance in Teaching Academic English Writing to Graduate Students Based on Language Intelligence Technology (ChatGPT)","H. Feng","School of Western Languages and Cultures, Harbin Normal University, Harbin, China","2024 IEEE 7th Eurasian Conference on Educational Innovation (ECEI)","8 May 2024","2024","","","313","316","With the development of information technology, language intelligence technology is widely used in education. Focusing on teaching academic English writing to graduate students, this study was carried out to explore the advantages of real-time language assistance based on language intelligence technology (ChatGPT) in enhancing students’ academic writing. Academic writing is important in graduate education, and real-time language support using ChatGPT may provide students with personalized and efficient help. By combining natural language processing and machine learning, ChatGPT provides instant suggestions and corrections in academic writing. This method is expected to improve writing efficiency and quality. Using an experimental design, the effects of ChatGPT on teaching academic writing were analyzed by comparing the experimental and control group performances. Students’ acceptance and satisfaction with this technology were surveyed. The results of this study provide a basis for improving the quality and effectiveness of teaching academic writing.","","979-8-3503-0720-7","10.1109/ECEI60433.2024.10510872","Harbin Normal University; ","https://ieeexplore.ieee.org/stamp/stamp.jsp?arnumber=10510872","language intelligence technology;ChatGPT;academic English writing;language assistance","Technological innovation;Education;Focusing;Machine learning;Writing;Chatbots;Real-time systems","","","","15","IEEE","8 May 2024","","","IEEE","IEEE Conferences"
"Work-in-Progress: Preliminary Work Introducing Automated Code Critiques in First-Year Engineering MATLAB Programming","L. Albrant; P. Pendse; L. E. Brown; J. Sticklen; M. Jarvie-Eggart; L. C. Ureel","Dept. of Cognitive and Learning Sciences, Michigan Technological University, Houghton, MI, USA; Dept. of Computer Science, Michigan Technological University, Houghton, MI, USA; Dept. of Computer Science, Michigan Technological University, Houghton, MI, USA; Department of Engineering Fundamentals, Michigan Technological University, Houghton, MI, USA; Department of Engineering Fundamentals, Michigan Technological University, Houghton, MI, USA; Dept. of Cognitive and Learning Sciences, Michigan Technological University, Houghton, MI, USA","2023 IEEE Frontiers in Education Conference (FIE)","5 Jan 2024","2023","","","1","5","This Work-in-Progress paper presents WebTA, a code critiquer developed using Java, currently being expanded to MATLAB for first-year engineering students. It outlines the modification process of the existing WebTA software for MATLAB and shares the results of three beta tests conducted with 52 students. The paper highlights the significance of providing an automated tool that helps students identify and improve coding errors is highlighted (addressing the gap between computer science and engineering education). WebTA's feedback-on-demand feature addresses the challenge of providing timely and personalized feedback to a large number of students, contributing to the enhancement of first-year engineering education.","2377-634X","979-8-3503-3642-9","10.1109/FIE58773.2023.10343067","National Science Foundation(grant numbers:2142309); ","https://ieeexplore.ieee.org/stamp/stamp.jsp?arnumber=10343067","first-year engineering;novice programming;MATLAB;auto critiquer","Java;Codes;Software;Encoding;Engineering students;Programming profession;Matlab","","","","6","IEEE","5 Jan 2024","","","IEEE","IEEE Conferences"
"""You Need to Get Them Where They Feel it"": Conflicting Perspectives on How to Maximize the Structure of Text-Message Psychological Interventions for Adolescents","M. L. Ranney; M. Thorsen; J. V. Patena; R. M. Cunningham; E. W. Boyer; M. A. Walton; A. Spirito; D. F. Zatzick; K. Morrow","Rhode Island Hosp., Brown Univ.; Brown Unversity; Rhode Island Hosp., Brown Univ.; University of Michigan; University of Massachusetts; University of Michigan; Brown Unversity; University of Washington; Brown Unversity","2015 48th Hawaii International Conference on System Sciences","30 Mar 2015","2015","","","3247","3255","Mobile psychological interventions are of growing interest, particularly for populations with little access to traditional mental health services. Optimum structural components of these interventions are unknown. In this study, twenty-one adolescents (age 13-17) with past two week depressive symptoms were recruited from the emergency department to participate in a semi-structured interview, to inform development of a text-message-based depression prevention intervention. Teens expressed conflict about intervention structure. Although trust and reliability were essential to sustain engagement, teens disagreed about how to best maintain reliability, whether the program should be ""pushed"" or ""pulled"", and what the ideal degree of human interaction would be. These findings highlight the challenges in automating psychological interventions that are normally delivered face-to-face. Data indicate a broad desire for developing tailoring methods for system design (duration, frequency, and level of interactivity). The paper closes with thoughts about potential solutions to these structural issues for mobile psychological interventions.","1530-1605","978-1-4799-7367-5","10.1109/HICSS.2015.391","","https://ieeexplore.ieee.org/stamp/stamp.jsp?arnumber=7070206","mobile health;text message;adolescent;qualitative;tailoring","Interviews;Psychology;Mobile communication;Reliability;Pediatrics;Encoding;Sociology","","12","","36","IEEE","30 Mar 2015","","","IEEE","IEEE Conferences"
"Analysis of Factors Affecting Patients’ Intention to Use Online Diagnosis and Treatment","L. H. Yang; D. Guo; B. Yu; D. F. Zhang","School of Humanities and Management, Yunnan University of Chinese Medicine, Kunming, China; School of Humanities and Management, Yunnan University of Chinese Medicine, Kunming, China; School of Humanities and Management, Yunnan University of Chinese Medicine, Kunming, China; School of Humanities and Management, Yunnan University of Chinese Medicine, Kunming, China","2023 2nd International Conference on Health Big Data and Intelligent Healthcare (ICHIH)","23 Jan 2024","2023","","","58","62","This study mainly analyzes the factors affecting patients’ intention to use online diagnosis and treatment. Based on the information system success model and technology acceptance model, the research hypothesis is proposed. A total of 410 samples were collected by the network questionnaire method. PLS-SEM was used to analyze the data and verify the research model. The results show that the system quality and service quality of the online diagnosis and treatment positively influence the perceived ease of use. Service quality positively and significantly affects perceived usefulness, while system quality has no significant effect on perceived usefulness. Perceived ease of use and perceived usefulness positively influence usage attitude. The attitude toward use positively and significantly affects the intention to use. By integrating the ISS model and TAM model, this study provides data support and policy suggestions for building an online diagnosis and treatment trusted by the patients and improving the level of online medical service.","","979-8-3503-0932-4","10.1109/ICHIH60370.2023.10396100","Yunnan Provincial Department of Education; Yunnan University; ","https://ieeexplore.ieee.org/stamp/stamp.jsp?arnumber=10396100","Online Diagnosis and Treatment;Information System Success Model;Technology Acceptance Model;Intention to Use","Analytical models;Technology acceptance model;Buildings;Medical services;Big Data;Data models;Information systems","","","","19","IEEE","23 Jan 2024","","","IEEE","IEEE Conferences"
"Energy efficiency in real-time systems: A brief overview","C. S. Stangaciu; M. V. Micea; V. I. Cretu","Computer and Software Engineering Department, Politehnica University of Timisoara, Timisoara, Romania; Computer and Software Engineering Department, Politehnica University of Timisoara, Timisoara, Romania; Computer and Software Engineering Department, Politehnica University of Timisoara, Timisoara, Romania","2013 IEEE 8th International Symposium on Applied Computational Intelligence and Informatics (SACI)","26 Sep 2013","2013","","","275","280","As the embedded and real-time control systems become ubiquitous, with increasingly stringent requirements of smaller size, their energy efficiency emerges as a problem of key interest. In this paper we review the state of the art of energy optimization techniques from the real-time systems point of view. The survey approaches both hardware and software aspects, including the real-time hardware support, various power-saving mechanisms, battery models, real-time power-aware scheduling and dynamic power management methods. The relevant solutions found in the literature are classified and briefly presented. A comparative discussion of these methods, focusing on a set of key aspects, summarizes the survey.","","978-1-4673-6400-3","10.1109/SACI.2013.6608981","","https://ieeexplore.ieee.org/stamp/stamp.jsp?arnumber=6608981","Power-Aware;Real Time Systems;Scheduling;Dynamic Voltage Scaling (DVS);Dynamic Power Management (DPM)","Real-time systems;Batteries;Hardware;Voltage control;Energy consumption;Clocks;Time-frequency analysis","","13","","39","IEEE","26 Sep 2013","","","IEEE","IEEE Conferences"
