Unnamed: 0,Cites,Authors,Title,Year,Source,Publisher,ArticleURL,CitesURL,GSRank,QueryDate,Type,DOI,ISSN,CitationURL,Volume,Issue,StartPage,EndPage,ECC,CitesPerYear,CitesPerAuthor,AuthorCount,Age,Abstract,FullTextURL,RelatedURL,_BaseArticleURL
122,15,"BA Gaudiano, E Moitra, S Ellenberg, MF Armey",The promises and challenges of ecological momentary assessment in schizophrenia: Development of an initial experimental protocol,2015.0,Healthcare,mdpi.com,https://www.mdpi.com/2227-9032/3/3/556,"https://scholar.google.com/scholar?cites=4570639786884707517&as_sdt=2005&sciodt=0,5&hl=en",72,2024-06-11 20:16:42,HTML,,,,,,,,15,1.67,4,4,9.0,"Abstract
Severe mental illnesses, including schizophrenia and other psychotic-spectrum disorders, are a major cause of disability worldwide. Although efficacious pharmacological and psychosocial interventions have been developed for treating patients with schizophrenia, relapse rates are high and long-term recovery remains elusive for many individuals. Furthermore, little is still known about the underlying mechanisms of these illnesses. Thus, there is an urgent need to better understand the contextual factors that contribute to psychosis so that they can be better targeted in future interventions. Ecological Momentary Assessment (EMA) is a dynamic procedure that permits the measurement of variables in natural settings in real-time through the use of brief assessments delivered via mobile electronic devices (i.e., smartphones). One advantage of EMA is that it is less subject to retrospective memory biases and highly sensitive to fluctuating environmental factors. In the current article, we describe the research-to-date using EMA to better understand fluctuating symptoms and functioning in patients with schizophrenia and other psychotic disorders and potential applications to treatment. In addition, we describe a novel EMA protocol that we have been employing to study the outcomes of patients with schizophrenia following a hospital discharge. We also report the lessons we have learned thus far using EMA methods in this challenging clinical population.",https://www.mdpi.com/2227-9032/3/3/556,"https://scholar.google.com/scholar?q=related:vbSHfassbj8J:scholar.google.com/&scioq=%22ecological+momentary+assessment%22%7C%22experience+sampling%22+%22ecological+momentary+intervention%22+%22mobile%22%7C%22smartphone%22%7C%22app%22&hl=en&as_sdt=0,5&as_vis=1",www.mdpi.com
132,13,"L Jiménez-Muñoz, I Peñuelas-Calvo…",Suicide prevention in your pocket: a systematic review of ecological momentary interventions for the management of suicidal thoughts and behaviors,2022.0,Harvard review of …,journals.lww.com,https://journals.lww.com/hrpjournal/fulltext/2022/03000/Suicide_Prevention_in_Your_Pocket__A_Systematic.1.aspx,"https://scholar.google.com/scholar?cites=337553512113564383&as_sdt=2005&sciodt=0,5&hl=en",115,2024-06-11 20:16:42,,,,,,,,,13,6.5,4,3,2.0,"
Abstract

Background 

This study reviews the evidence on ecological momentary interventions (EMIs) for managing and preventing suicidal thoughts and behaviors.

Methods 

This review follows the Preferred Reporting Items for Systematic Reviews and Meta-analyses guidelines. Its protocol was registered in the PROSPERO database. We conducted a systematic literature search of five databases: PubMed, EMBASE, Web of Science, PsycInfo, and Cochrane library. The most recent search date was 10 September 2021.

Results 

After screening and full-text review, 27 studies were included, totaling 19 different interventions. Many of the available interventions have not yet been clinically tested. Those that have undergone effectiveness evaluation (10 interventions) showed good rates of effectiveness and feasibility, with some exceptions. The most widely used intervention model is the safety plan, which allows the user to implement coping and distracting strategies in case of suicidal ideation.

Conclusions 

Ecological momentary interventions provide certain advantages, such as their wide availability, versatility, and potential for customization. These interventions can be useful complements to traditional care, especially in situations in which face-to-face care is not possible. Evidence on the effectiveness of such interventions is still scarce. Furthermore, barriers limiting implementation in clinical practice remain. The constant advance of technology means that these interventions have great potential for improvement in the coming years.
",,"https://scholar.google.com/scholar?q=related:3-o2fiE7rwQJ:scholar.google.com/&scioq=%22ecological+momentary+assessment%22%7C%22experience+sampling%22+%22ecological+momentary+intervention%22+%22mobile%22%7C%22smartphone%22%7C%22app%22&hl=en&as_sdt=0,5&as_vis=1",journals.lww.com
140,11,"D Castilla, MV Navarro-Haro, C Suso-Ribera…",Ecological momentary intervention to enhance emotion regulation in healthcare workers via smartphone: a randomized controlled trial protocol,2022.0,BMC psychiatry,Springer,https://link.springer.com/article/10.1186/s12888-022-03800-x,"https://scholar.google.com/scholar?cites=13753203142197810273&as_sdt=2005&sciodt=0,5&hl=en",14,2024-06-11 20:16:42,HTML,10.1186/s12888-022-03800-x,,,,,,,11,5.5,3,4,2.0,"Background

CUIDA-TE is an APP that offers transdiagnostic cognitive behavioral therapy focused on enhancing emotion regulation. As a novelty, it incorporates ecological momentary interventions (EMI), which can provide psychological support in real time, when suffering arises. The main goal of the study is to evaluate the efficacy of CUIDA-TE to improve emotion regulation in healthcare workers, a population that has been particularly emotionally impacted by the COVID-19 pandemic.

Methods

In this three-arm, randomized controlled trial (RCT) the study sample will be composed of a minimum of 174 healthcare workers. They will be randomly assigned to a 2-month EMI group (CUIDA-TE APP, n ≥ 58), a 2-month ecological momentary assessment (EMA) only group (MONITOR EMOCIONAL APP, n ≥ 58), or a wait-list control group (no daily monitoring nor intervention, n ≥ 58). CUIDA-TE will provide EMI if EMA reveals emotional problems, poor sleep quality/quantity, burnout, stress, or low perceived self-efficacy when regulating emotions. Depression will be the primary outcome. Secondary outcomes will include emotion regulation, quality of life, and resilience. Treatment acceptance and usability will also be measured. Primary and secondary outcomes will be obtained at pre- and post-intervention measurements, and at the 3-month follow-up for all groups.

Discussion

To our knowledge, this is the first RCT that evaluates the efficacy of an APP-based EMI to improve emotion regulation skills in healthcare workers. This type of intervention might ultimately help disseminate treatments and reach a larger number of individuals than traditional face-to-face individual therapies.

Trial registration

ClinicalTrial.gov: NCT04958941 Registered 7 Jun 2021.

Study status

Participant recruitment has not started.",https://link.springer.com/article/10.1186/s12888-022-03800-x,"https://scholar.google.com/scholar?q=related:YZR85mMx3b4J:scholar.google.com/&scioq=%22ecological+momentary+assessment%22%7C%22experience+sampling%22+%22ecological+momentary+intervention%22+%22mobile%22%7C%22smartphone%22%7C%22app%22&hl=en&as_sdt=0,5&as_vis=1",link.springer.com
141,11,"R Lucas-Thompson, N Seiter, PC Broderick…",Moving 2 Mindful (M2M) study protocol: testing a mindfulness group plus ecological momentary intervention to decrease stress and anxiety in adolescents from high …,2019.0,BMJ open,bmjopen.bmj.com,https://bmjopen.bmj.com/content/9/11/e030948.abstract,"https://scholar.google.com/scholar?cites=7874563300095293779&as_sdt=2005&sciodt=0,5&hl=en",150,2024-06-11 20:16:42,,,,,,,,,11,2.2,3,4,5.0,"Abstract

Introduction Interparental conflict exposure places adolescents at risk for problems with stress and anxiety; existing prevention/intervention strategies focus on reducing interparental conflict. Mindfulness-based programmes may be a promising treatment strategy for this population, but studies have not yet tested whether they are effective in this high-conflict context. In addition, evidence suggests that extensions to traditional treatments, such as delivering components in daily life that are tailored to moments of need, can increase treatment efficacy, particularly when combined with in-person treatments and particularly for adolescents. However, there are no such extensions to mindfulness interventions available. The Moving 2 Mindful study aims to (1) develop an ecological momentary intervention (EMI) supplement to Learning to BREATHE (L2B), an evidence-based mindfulness intervention for adolescents; (2) refine the EMI programme and determine the best delivery plan; (3) examine the feasibility and acceptability of L2B Plus (L2B plus the developed supplement) and (4) examine the potential for L2B Plus to reduce stress and anxiety for adolescents from high-conflict homes.

Methods and analysis The Moving 2 Mindful study proposes a mixed-methods approach to developing and refining a multimethod adaptive supplement to L2B. Feasibility, acceptability and potential effectiveness will be tested in a sample of 38 families, who will be randomly assigned to receive L2B Plus or an active health and wellness control condition and followed until 3 months postintervention. A range of psychosocial and physiological factors will be assessed at multiple time points. This study is registered with clinicaltrials.gov (ID NCT03869749; pre-results).

Ethics and dissemination The Institutional Review Board at Colorado State University has approved this study. Findings will be disseminated in scientific journals and conferences, whether they are positive, negative or inconclusive.",https://bmjopen.bmj.com/content/bmjopen/9/11/e030948.full.pdf,"https://scholar.google.com/scholar?q=related:U_mBp5kRSG0J:scholar.google.com/&scioq=%22ecological+momentary+assessment%22%7C%22experience+sampling%22+%22ecological+momentary+intervention%22+%22mobile%22%7C%22smartphone%22%7C%22app%22&hl=en&as_sdt=0,5&as_vis=1",bmjopen.bmj.com
144,11,"BA Hultgren, NM Scaglione, A Buben, R Turrisi",Examining protocol compliance and self-report congruence between daily diaries and event-contingent ecological momentary assessments of college student …,2020.0,Addictive behaviors,Elsevier,https://www.sciencedirect.com/science/article/pii/S0306460320306018,"https://scholar.google.com/scholar?cites=3968944815094153774&as_sdt=2005&sciodt=0,5&hl=en",256,2024-06-11 20:16:42,,,,,,,,,11,2.75,3,4,4.0,"Highlights

•

A Alcohol use and intoxication were similar in event-contingent EMA and daily diaries.

•

Daily diaries had higher compliance than event-contingent EMA on drinking days.

•

Missing EMA associated with higher alcohol use and intoxication reported in daily diaries.

Abstract
Background

Daily diaries and ecological momentary assessments (EMA) are frequently used to assess event-level college student drinking. While both methods have advantages, they also raise questions about data validity, particularly in regard to alcohol’s impact on protocol compliance. The current study examined congruence in drinking behaviors reported via retrospective daily diaries and event-contingent drinking logs, protocol compliance with each method, and the extent to which alcohol consumption impacted compliance.

Methods

Participants were first-semester college women (n = 69) who reported 4+ drinks during an occasion at least once in the past month. Participants reported the number of drinks consumed and subjective intoxication using a 14-day EMA protocol. Event-contingent drinking logs (via self-initiated EMA) assessed behavior immediately after each drinking event; daily diaries assessed behaviors from the previous day. Pairwise correlations examined congruence between drinking logs and corresponding daily dairies; protocol compliance was examined through descriptive analysis of data missingness; and multilevel regression models assessed the associations between protocol compliance, alcohol consumption, and subjective intoxication.

Results

Drinking log and daily diary reports were highly correlated (r’s = 0.70 to 0.93). On drinking days, diary reports had higher protocol compliance (96.0%) compared to momentary drinking logs (41.4%). Drinking log missingness was associated with greater alcohol use and subjective intoxication reported in the corresponding daily diary (p’s < 0.05).

Conclusions

Similarities in reports of alcohol consumption and subjective intoxication, coupled with higher missingness of momentary assessments suggest daily diaries may have methodological advantages and unique utility in supplementing momentary assessments.",https://www.ncbi.nlm.nih.gov/pmc/articles/PMC7919385/,"https://scholar.google.com/scholar?q=related:LsLQ7EeGFDcJ:scholar.google.com/&scioq=%22ecological+momentary+assessment%22%7C%22experience+sampling%22+%22ecological+momentary+intervention%22+%22mobile%22%7C%22smartphone%22%7C%22app%22&hl=en&as_sdt=0,5&as_vis=1",www.sciencedirect.com
147,10,"A Colonna, A Bracci, J Ahlberg…",Ecological momentary assessment of awake bruxism behaviors: a scoping review of findings from smartphone-based studies in healthy young adults,2023.0,Journal of clinical …,mdpi.com,https://www.mdpi.com/2077-0383/12/5/1904,"https://scholar.google.com/scholar?cites=768477481421527485&as_sdt=2005&sciodt=0,5&hl=en",123,2024-06-11 20:16:42,HTML,,,,,,,,10,10.0,3,4,1.0,"Abstract
Background: The recent introduction of ecological momentary assessment (EMA) smartphone-based strategies has allowed achieving some interesting data on the frequency of different awake bruxism (AB) behaviors reported by an individual in the natural environment. Objective: The present paper aims to review the literature on the reported frequency of AB based on data gathered via smartphone EMA technology. Methods: On September 2022, a systematic search in the Pubmed, Scopus and Google Scholar databases was performed to identify all peer-reviewed English-language studies assessing awake bruxism behaviors using a smartphone-based Ecological Momentary Assessment. The selected articles were assessed independently by two authors according to a structured reading of the articles’ format (PICO). Results: A literature search, for which the search terms “Awake Bruxism” and “Ecological Momentary Assessment” were used, identified 15 articles. Of them, eight fulfilled the inclusion criteria. The results of seven studies using the same smartphone-based app reported a frequency of AB behaviors in the range between 28.3 and 40% over one week, while another investigation adopted a different smartphone-based EMA approach via WhatsApp using a web-based survey program and reported an AB frequency of 58.6%. Most included studies were based on convenience samples with limited age range, highlighting the need for more studies on other population samples. Conclusions: Despite the methodological limits, the results of the reviewed studies provide a standpoint for comparison for future studies on the epidemiology of awake bruxism behaviors.",https://www.mdpi.com/2077-0383/12/5/1904,"https://scholar.google.com/scholar?q=related:vVkEojIuqgoJ:scholar.google.com/&scioq=%22ecological+momentary+assessment%22%7C%22experience+sampling%22+%22ecological+momentary+intervention%22+%22mobile%22%7C%22smartphone%22%7C%22app%22&hl=en&as_sdt=0,5&as_vis=1",www.mdpi.com
154,8,"ML Barrigon, A Porras-Segovia, P Courtet…",Smartphone-based Ecological Momentary Intervention for secondary prevention of suicidal thoughts and behaviour: protocol for the SmartCrisis V. 2.0 randomised …,2022.0,BMJ open,bmjopen.bmj.com,https://bmjopen.bmj.com/content/12/9/e051807.abstract,"https://scholar.google.com/scholar?cites=1447282074761640155&as_sdt=2005&sciodt=0,5&hl=en",53,2024-06-11 20:16:42,,,,,,,,,8,4.0,2,4,2.0,"Abstract

Introduction Suicide is one of the leading public health issues worldwide. Mobile health can help us to combat suicide through monitoring and treatment. The SmartCrisis V.2.0 randomised clinical trial aims to evaluate the effectiveness of a smartphone-based Ecological Momentary Intervention to prevent suicidal thoughts and behaviour.

Methods and analysis The SmartCrisis V.2.0 study is a randomised clinical trial with two parallel groups, conducted among patients with a history of suicidal behaviour treated at five sites in France and Spain. The intervention group will be monitored using Ecological Momentary Assessment (EMA) and will receive an Ecological Momentary Intervention called ‘SmartSafe’ in addition to their treatment as usual (TAU). TAU will consist of mental health follow-up of the patient (scheduled appointments with a psychiatrist) in an outpatient Suicide Prevention programme, with predetermined clinical appointments according to the Brief Intervention Contact recommendations (1, 2, 4, 7 and 11 weeks and 4, 6, 9 and 12 months). The control group would receive TAU and be monitored using EMA.

Ethics and dissemination This study has been approved by the Ethics Committee of the University Hospital Fundación Jiménez Díaz. It is expected that, in the near future, our mobile health intervention and monitoring system can be implemented in routine clinical practice. Results will be disseminated through peer-reviewed journals and psychiatric congresses. Reference number EC005-21_FJD. Participants gave informed consent to participate in the study before taking part.

Trial registration number NCT04775160.",https://bmjopen.bmj.com/content/bmjopen/12/9/e051807.full.pdf,"https://scholar.google.com/scholar?q=related:2zj1A2HHFRQJ:scholar.google.com/&scioq=%22ecological+momentary+assessment%22%7C%22experience+sampling%22+%22ecological+momentary+intervention%22+%22mobile%22%7C%22smartphone%22%7C%22app%22&hl=en&as_sdt=0,5&as_vis=1",bmjopen.bmj.com
158,8,"D Edge, A Newbold, T Ehring, T Rosenkranz, M Frost…",Reducing worry and rumination in young adults via a mobile phone app: study protocol of the ECoWeB (Emotional Competence for Well-Being in Young …,2021.0,BMC psychiatry,Springer,https://link.springer.com/article/10.1186/s12888-021-03536-0,"https://scholar.google.com/scholar?cites=7018454288821588267&as_sdt=2005&sciodt=0,5&hl=en",281,2024-06-11 20:16:42,HTML,10.1186/s12888-021-03536-0,,,,,,,8,2.67,1,6,3.0,"Background

Promoting well-being and preventing poor mental health in young people is a major global priority. Building emotional competence skills via a mobile app may be an effective, scalable and acceptable way to do this. A particular risk factor for anxiety and depression is elevated worry and rumination (repetitive negative thinking, RNT). An app designed to reduce RNT may prevent future incidence of depression and anxiety.

Method/design

The Emotional Competence for Well-Being in Young Adults study developed an emotional competence app to be tested via randomised controlled trials in a longitudinal prospective cohort. This off-shoot study adapts the app to focus on targeting RNT (worry, rumination), known risk factors for poor mental health. In this study, 16–24 year olds in the UK, who report elevated worry and rumination on standardised questionnaires are randomised to (i) receive the RNT-targeting app immediately for 6 weeks (ii) a waiting list control who receive the app after 6 weeks. In total, the study will aim to recruit 204 participants, with no current diagnosis of major depression, bipolar disorder or psychosis, across the UK. Assessments take place at baseline (pre-randomisation), 6 and 12 weeks post-randomisation. Primary endpoint and outcome for the study is level of rumination assessed on the Rumination Response Styles Questionnaire at 6 weeks. Worry, depressive symptoms, anxiety symptoms and well-being are secondary outcomes. Compliance, adverse events and potentially mediating variables will be carefully monitored.

Discussion

This trial aims to better understand the benefits of tackling RNT via an mobile phone app intervention in young people. This prevention mechanism trial will establish whether targeting worry and rumination directly via an app provides a feasible approach to prevent depression and anxiety, with scope to become a widescale public health strategy for preventing poor mental health and promoting well-being in young people.

Trial registration

ClinicalTrials.gov, NCT04950257. Registered 6 July 2021 – Retrospectively registered.",https://link.springer.com/article/10.1186/s12888-021-03536-0,"https://scholar.google.com/scholar?q=related:KxGHhf2OZmEJ:scholar.google.com/&scioq=%22ecological+momentary+assessment%22%7C%22experience+sampling%22+%22ecological+momentary+intervention%22+%22mobile%22%7C%22smartphone%22%7C%22app%22&hl=en&as_sdt=0,5&as_vis=1",link.springer.com
